Symbol,Name,Last Sale,Net Change,% Change,Market Cap,Country,IPO Year,Volume,Sector,Industry
AAMC,Altisource Asset Management Corp Com,$19.70,0.25,1.285%,40351884.00,United States,,2593,Finance,Investment Managers
AAU,Almaden Minerals Ltd. Common Shares,$0.5391,-0.0019,-0.351%,73976061.00,Canada,2015,277347,Basic Industries,Precious Metals
ACU,Acme United Corporation. Common Stock,$43.65,0.64,1.488%,152055954.00,United States,1988,12411,Consumer Durables,Home Furnishings
ACY,AeroCentury Corp. Common Stock,$10.41,-0.21,-1.977%,16092652.00,United States,,32996,Technology,Diversified Commercial Services
ADRA,Adara Acquisition Corp. Class A Common Stock,$9.7125,-0.0475,-0.487%,139617188.00,,2021,4201,,
AE,Adams Resources & Energy Inc. Common Stock,$27.64,-1.60,-5.472%,117498055.00,United States,,6309,Energy,Oilfield Services/Equipment
AEF,Aberdeen Emerging Markets Equity Income Fund Inc. Common Stock,$9.18,0.05,0.548%,465901322.00,United States,,17835,,
AGE,AgeX Therapeutics Inc. Common Stock,$1.5199,-0.0101,-0.66%,57657540.00,,2018,29840,Health Care,Major Pharmaceuticals
AIM,AIM ImmunoTech Inc. Common Stock,$2.34,0.06,2.632%,92874628.00,United States,,764794,Health Care,Biotechnology: Biological Products (No Diagnostic Substances)
AINC,Ashford Inc. (Holding Company) Common Stock,$25.4488,0.6588,2.658%,76591803.00,United States,2014,14949,Consumer Services,Professional Services
AIRI,Air Industries Group Common Stock,$1.26,-0.01,-0.787%,40367309.00,United States,,267756,Capital Goods,Military/Government/Technical
AMBO,Ambow Education Holding Ltd. American Depository Shares each representing two Class A ordinary shares,$2.55,0.18,7.595%,59220359.00,China,,513789,Miscellaneous,Service to the Health Industry
AMPE,Ampio Pharmaceuticals Inc.,$1.805,0.025,1.404%,353218876.00,United States,,798495,Health Care,Major Pharmaceuticals
AMS,American Shared Hospital Services Common Stock,$3.385,-0.015,-0.441%,19636385.00,United States,,170748,Health Care,Medical Specialities
ANVS,Annovis Bio Inc. Common Stock,$87.14,-3.86,-4.242%,605385021.00,United States,2020,734667,Consumer Durables,Specialty Chemicals
APT,Alpha Pro Tech Ltd. Common Stock,$8.35,0.12,1.458%,111324296.00,Canada,,85957,,
ARMP,Armata Pharmaceuticals Inc. Common Stock,$4.2573,-0.3327,-7.248%,106178944.00,United States,,33445,Health Care,Biotechnology: Biological Products (No Diagnostic Substances)
ASM,Avino Silver & Gold Mines Ltd. Common Shares (Canada),$1.3375,0.0275,2.099%,134911009.00,Canada,,642072,,
ASXC,Asensus Surgical Inc. Common Stock,$3.48,0.26,8.075%,811608447.00,United States,,7058561,Health Care,Medical/Dental Instruments
ATNM,Actinium Pharmaceuticals Inc. (Delaware) Common Stock,$8.57,0.06,0.705%,173070027.00,United States,,112028,Health Care,Major Pharmaceuticals
AUMN,Golden Minerals Company Common Stock,$0.71,-0.01,-1.389%,115353425.00,United States,,574943,,
AWX,Avalon Holdings Corporation Common Stock,$4.6012,-0.0188,-0.407%,17942062.00,United States,,41548,Public Utilities,Environmental Services
AXU,Alexco Resource Corp Common Shares (Canada),$2.8264,-0.1136,-3.864%,402670916.00,Canada,,2183794,Basic Industries,Precious Metals
BATL,Battalion Oil Corporation Common Stock,$13.171,-0.089,-0.671%,214260520.00,,,17293,Energy,Oil & Gas Production
BCV,Bancroft Fund Ltd.,$31.8714,0.2814,0.891%,175859565.00,United States,,3662,,
BCV^A,Bancroft Fund Limited 5.375% Series A Cumulative Preferred Shares,$25.7912,0.0212,0.082%,,United States,,2555,,
BDL,Flanigan's Enterprises Inc. Common Stock,$32.815,-1.685,-4.884%,60991501.00,United States,,1622,Consumer Services,Restaurants
BDR,Blonder Tongue Laboratories Inc. Common Stock,$1.2911,-0.0089,-0.685%,15442208.00,United States,,47738,Capital Goods,Industrial Machinery/Components
BGI,Birks Group Inc. Common Stock,$2.86,0.04,1.418%,51396720.00,Canada,,141992,,
BHB,Bar Harbor Bankshares Inc. Common Stock,$29.44,0.06,0.204%,440872832.00,United States,,9727,Finance,Major Banks
BKTI,BK Technologies Corporation Common Stock,$3.13,-0.02,-0.635%,52539307.00,United States,,95640,Technology,Radio And Television Broadcasting And Communications Equipment
BMTX,BM Technologies Inc. Common Stock,$13.5682,-0.4718,-3.36%,165537169.00,,2018,59024,Technology,EDP Services
BRBS,Blue Ridge Bankshares Inc. Common Stock,$17.31,0.23,1.347%,483504547.00,,,51707,Finance,Commercial Banks
BRG,Bluerock Residential Growth REIT Inc. Class A Common Stock,$10.20,0.10,0.99%,288581807.00,,2014,213586,Consumer Services,Real Estate Investment Trusts
BRG^C,Bluerock Residential Growth REIT Inc. 7.625% Series C Cumulative Redeemable Preferred Stock,$25.56,-0.08,-0.312%,,,,368,,
BRG^D,Bluerock Residential Growth REIT Inc. 7.125% Series D Cumulative Preferred Stock ($0.01 par value per share),$25.35,0.04,0.158%,,,,450,,
BRN,Barnwell Industries Inc. Common Stock,$3.00,-0.05,-1.639%,24831480.00,United States,,61729,Energy,Oil & Gas Production
BTG,B2Gold Corp Common shares (Canada),$4.9111,-0.0189,-0.383%,5166225403.00,Canada,,3510130,Basic Industries,Precious Metals
BTN,Ballantyne Strong Inc. Common Stock,$4.81,0.11,2.34%,88030427.00,United States,,50040,Miscellaneous,Industrial Machinery/Components
BTX,Brooklyn ImmunoTherapeutics Inc. Common Stock,$15.53,1.23,8.601%,662893049.00,United States,,6213680,,
BWL/A,Bowl America Inc.,$8.89,0.00,0.00%,,United States,,906,,
CANF,Can-Fite Biopharma Ltd Sponsored ADR (Israel),$2.2368,-0.0132,-0.587%,38454043.00,Israel,,59340,Health Care,Major Pharmaceuticals
CCF,Chase Corporation Common Stock,$101.31,0.03,0.03%,957214466.00,United States,,7231,Basic Industries,Paints/Coatings
CDOR,Condor Hospitality Trust Inc. Common Stock,$4.90,0.01,0.204%,58932055.00,United States,,7927,Consumer Services,Real Estate Investment Trusts
CEI,Camber Energy Inc. Common Stock,$0.6754,-0.0146,-2.116%,28401097.00,United States,,2941219,Energy,Oil & Gas Production
CET,Central Securities Corporation Common Stock,$41.90,-0.0026,-0.006%,1099472886.00,United States,,15844,,
CEV,Eaton Vance California Municipal Income Trust Shares of Beneficial Interest,$13.704,0.014,0.102%,97758512.00,United States,1999,8167,,
CHAQ,Chardan Healthcare Acquisition 2 Corp. Common Stock,$10.02,0.00,0.00%,107998616.00,,2020,363,,
CHFW,Consonance-HFW Acquisition Corp. Class A Ordinary Shares,$9.8983,-0.0018,-0.018%,118126312.00,,2021,1367,,
CIK,Credit Suisse Asset Management Income Fund Inc. Common Stock,$3.475,-0.015,-0.43%,181759628.00,United States,,1626422,,
CIX,CompX International Inc. Common Stock,$22.10,0.07,0.318%,274065570.00,United States,1998,3106,Miscellaneous,Diversified Manufacture
CKX,CKX Lands Inc. Common Stock,$13.0164,-0.2086,-1.577%,25284292.00,United States,,252,Energy,Oil & Gas Production
CLM,Cornerstone Strategic Value Fund Inc. New Common Stock,$11.4199,-0.1501,-1.297%,887011440.00,United States,1987,659563,,
CMCL,Caledonia Mining Corporation Plc Common Shares,$13.77,-0.17,-1.22%,166876193.00,Canada,,60587,Basic Industries,Precious Metals
CMT,Core Molding Technologies Inc Common Stock,$13.70,0.40,3.008%,116237335.00,United States,,5822,Consumer Durables,Electronic Components
COHN,Cohen & Company Inc.,$24.3436,0.4136,1.728%,32304858.00,United States,,60617,Finance,Investment Managers
CPHI,China Pharma Holdings Inc. Common Stock,$0.7351,0.0284,4.019%,32035332.00,China,,351729,Health Care,Major Pharmaceuticals
CQP,Cheniere Energy Partners LP Cheniere Energy Partners LP Common Units,$44.03,0.81,1.874%,21311450046.00,United States,2007,171567,Public Utilities,Oil/Gas Transmission
CRF,Cornerstone Total Return Fund Inc. (The) Common Stock,$11.11,-0.16,-1.42%,455994485.00,United States,,440798,,
CTEK,CynergisTek Inc. Common Stock,$2.0725,0.0425,2.094%,25120147.00,United States,2017,190548,Technology,Retail: Computer Software & Peripheral Equipment
CVM,Cel-Sci Corporation Common Stock,$21.49,-0.72,-3.242%,883863607.00,United States,,498721,Health Care,Biotechnology: Biological Products (No Diagnostic Substances)
CVR,Chicago Rivet & Machine Co. Common Stock,$25.96,-0.02,-0.077%,25080787.00,United States,,1798,Consumer Non-Durables,Industrial Specialties
CVU,CPI Aerostructures Inc. Common Stock,$3.725,-0.125,-3.247%,45557819.00,United States,,29353,Capital Goods,Military/Government/Technical
DHY,Credit Suisse High Yield Bond Fund Common Stock,$2.52,0.00,0.00%,260838653.00,United States,1998,474496,,
DIT,AMCON Distributing Company Common Stock,$143.50,4.4414,3.194%,79121452.00,United States,,452,Consumer Non-Durables,Food Distributors
DLA,Delta Apparel Inc. Common Stock,$29.60,-0.50,-1.661%,206449936.00,United States,,21963,Consumer Non-Durables,Department/Specialty Retail Stores
DMF,BNY Mellon Municipal Income Inc. Common Stock,$9.11,0.00,0.00%,189050784.00,United States,1988,10113,,
DNN,Denison Mines Corp Ordinary Shares (Canada),$1.3518,-0.0582,-4.128%,1088071162.00,Canada,,15119498,Basic Industries,Other Metals and Minerals
DPW,Ault Global Holdings Inc. Common Stock,$3.13,0.10,3.30%,155794304.00,United States,,1986286,Capital Goods,Industrial Machinery/Components
DSS,Document Security Systems Inc. Common Stock,$2.84,-0.12,-4.054%,94061155.00,United States,,512950,Consumer Services,Recreational Products/Toys
DXF,Dunxin Financial Holdings Limited American Depositary Shares,$1.72,0.04,2.381%,35912202.00,China,,134340,Consumer Non-Durables,Apparel
DXR,Daxor Corporation Common Stock,$12.05,-0.485,-3.869%,48608218.00,United States,,6419,Health Care,Medical/Dental Instruments
EAD,Wells Fargo Income Opportunities Fund Common Shares,$8.67,-0.09,-1.027%,525282475.00,United States,2003,132140,,
ECF,Ellsworth Growth and Income Fund Ltd.,$14.465,0.065,0.451%,195269660.00,United States,1986,9430,,
ECF^A,Ellsworth Growth and Income Fund Ltd. 5.25% Series A Cumulative Preferred Shares (Liquidation Preference $25.00 per share),$26.12,0.04,0.153%,,United States,,101,,
EIM,Eaton Vance Municipal Bond Fund Common Shares of Beneficial Interest $.01 par value,$13.65,0.01,0.073%,982160962.00,United States,2002,78051,,
ELA,Envela Corporation Common Stock,$5.50,-0.33,-5.66%,148084096.00,United States,,126166,Consumer Services,Consumer Specialties
ELLO,Ellomay Capital Ltd Ordinary Shares (Israel),$31.40,1.549,5.189%,403158008.00,Israel,,7326,Public Utilities,Electric Utilities: Central
ELMD,Electromed Inc. Common Stock,$10.82,-0.04,-0.368%,93456884.00,United States,2011,29911,Health Care,Biotechnology: Electromedical & Electrotherapeutic Apparatus
EMAN,eMagin Corporation Common Stock,$3.8537,0.4137,12.026%,278510471.00,United States,,2215294,Capital Goods,Industrial Machinery/Components
EMX,EMX Royalty Corporation Common Shares (Canada),$3.26,-0.01,-0.306%,279206442.00,Canada,,90025,Basic Industries,Precious Metals
ENSV,Enservco Corporation Common Stock,$1.5418,-0.0482,-3.031%,17626977.00,United States,,166902,Energy,Oilfield Services/Equipment
ENX,Eaton Vance New York Municipal Bond Fund Common Shares of Beneficial Interest $.01 par value,$12.95,0.02,0.155%,234631907.00,United States,2002,12682,,
EPM,Evolution Petroleum Corporation Inc. Common Stock,$5.04,0.01,0.199%,168877558.00,United States,,113110,Energy,Oil & Gas Production
EQX,Equinox Gold Corp. Common Shares,$9.14,0.24,2.697%,2731721915.00,Canada,,1082711,Basic Industries,Precious Metals
ERC,Wells Fargo Multi-Sector Income Fund Common Stock no par value,$12.8899,0.0199,0.155%,361788544.00,United States,2003,52935,,
ERH,Wells Fargo Utilities and High Income Fund,$14.6101,-0.0399,-0.272%,135601598.00,,2004,11195,,
ESP,Espey Mfg. & Electronics Corp. Common Stock,$15.33,0.00,0.00%,41431364.00,United States,,53,Capital Goods,Industrial Machinery/Components
EVBN,Evans Bancorp Inc. Common Stock,$38.59,-0.15,-0.387%,209682778.00,United States,,14160,Finance,Major Banks
EVI,EVI Industries Inc.  Common Stock,$31.949,-0.651,-1.997%,391636369.00,United States,,2047,Capital Goods,Industrial Machinery/Components
EVM,Eaton Vance California Municipal Bond Fund Common Shares of Beneficial Interest $.01 par value,$11.825,-0.025,-0.211%,295558059.00,United States,2002,37868,,
EVV,Eaton Vance Limited Duration Income Fund Common Shares of Beneficial Interest,$13.045,0.065,0.501%,1515137850.00,United States,2003,312922,,
EVY,Eaton Vance New York Municipal Income Trust Shares of Beneficial Interest,$15.06,0.01,0.066%,81351530.00,United States,1999,5306,,
EXN,Excellon Resources Inc. Common Shares,$2.81,-0.02,-0.707%,90995145.00,,2020,27506,Basic Industries,Precious Metals
FAX,Aberdeen Asia-Pacific Income Fund Inc Common Stock,$4.40,0.03,0.686%,1089861379.00,United States,1986,303056,,
FCO,Aberdeen Global Income Fund Inc. Common Stock,$8.6912,-0.0188,-0.216%,75929035.00,United States,1992,32197,,
FEN,First Trust Energy Income and Growth Fund,$15.3025,0.0825,0.542%,297565835.00,United States,2004,14064,,
FRD,Friedman Industries Inc. Common Stock,$13.385,-0.065,-0.483%,92434789.00,United States,,22366,Basic Industries,Steel/Iron Ore
FSI,Flexible Solutions International Inc. Common Stock (CDA),$3.56,-0.03,-0.836%,43844056.00,Canada,,8906,Capital Goods,Recreational Products/Toys
FSP,Franklin Street Properties Corp. Common Stock,$5.525,-0.025,-0.45%,592988299.00,United States,,82449,Consumer Services,Real Estate Investment Trusts
FTF,Franklin Limited Duration Income Trust Common Shares of Beneficial Interest,$9.2299,0.0199,0.216%,278178433.00,United States,2003,79834,,
FTSI,FTS International Inc. Class A Common Stock,$24.59,-0.61,-2.421%,344013362.00,United States,2020,39926,Energy,Oilfield Services/Equipment
FURY,Fury Gold Mines Limited Common Shares,$1.26,-0.03,-2.326%,148592724.00,,2020,246571,Basic Industries,Precious Metals
GAU,Galiano Gold Inc.,$1.23,0.00,0.00%,276347939.00,Canada,,589103,Basic Industries,Precious Metals
GBR,New Concept Energy Inc Common Stock,$4.82,-0.09,-1.833%,24735922.00,United States,,199143,Consumer Services,Real Estate
GDP,Goodrich Petroleum Corporation Common Stock,$12.16,0.00,0.00%,162971859.00,United States,2017,28286,Energy,Oil & Gas Production
GGN,GAMCO Global Gold Natural Resources & Income Trust,$4.21,0.05,1.202%,648256368.00,United States,2005,554693,,
GGN^B,GAMCO Global Gold Natural Reources & Income Trust 5.00% Series B Cumulative 25.00 Liquidation Preference,$25.56,0.01,0.039%,,United States,,1368,,
GGO,The Gabelli Go Anywhere Trust Common Shares of Beneficial Interest,$16.21,-0.1089,-0.667%,25076092.00,,2016,834,,
GGO^A,The Gabelli Go Anywhere Trust Series A Cumulative Puttable and Callable Preferred Shares,$40.79,0.00,0.00%,,,,175,,
GLDG,GoldMining Inc. Common Shares,$1.61,-0.01,-0.617%,240713322.00,,,253661,Basic Industries,Precious Metals
GLO,Clough Global Opportunities Fund Common Stock,$12.42,0.21,1.72%,400227197.00,United States,2006,299976,,
GLQ,Clough Global Equity Fund Clough Global Equity Fund Common Shares of Beneficial Interest,$14.91,-0.17,-1.127%,197271660.00,United States,2005,68886,,
GLU,Gabelli Global Utility Common Shares of Beneficial Ownership,$22.3809,0.1809,0.815%,120265512.00,United States,2004,7950,,
GLU^A,The Gabelli Global Utility and Income Trust Series A Cumulative Puttable and Callable Preferred Shares,$48.45,2.8535,6.258%,,United States,,419,,
GLV,Clough Global Dividend and Income Fund Common Shares of beneficial interest,$11.21,0.00,0.00%,94414588.00,United States,2004,52286,,
GOED,1847 Goedeker Inc. Commom Stock,$3.08,0.12,4.054%,317604315.00,United States,2020,7979818,Capital Goods,Recreational Products/Toys
GORO,Gold Resource Corporation Common Stock,$2.845,-0.115,-3.885%,211779538.00,United States,,588901,Basic Industries,Precious Metals
GPL,Great Panther Mining Limited Ordinary Shares (Canada),$0.7002,-0.0165,-2.302%,248850925.00,Canada,,1556281,Basic Industries,Precious Metals
GRF,Eagle Capital Growth Fund Inc. Common Stock,$9.13,0.0866,0.958%,37198551.00,United States,,700,,
GROY,Gold Royalty Corp. Common Shares,$5.48,0.57,11.609%,228084982.00,,2021,516954,,
GSAT,Globalstar Inc. Common Stock,$1.315,0.015,1.154%,2356480000.00,United States,2006,7962345,Consumer Services,Telecommunications Equipment
GSS,Golden Star Resources Ltd Common Stock,$3.31,-0.02,-0.601%,379632053.00,United States,,139918,Basic Industries,Precious Metals
GSV,Gold Standard Ventures Corporation Common Stock (Canada),$0.5921,-0.0126,-2.084%,211661661.00,Canada,,513161,Basic Industries,Mining & Quarrying of Nonmetallic Minerals (No Fuels)
GTE,Gran Tierra Energy Inc. Common Stock,$0.6898,0.0058,0.848%,253143877.00,Canada,,1597980,Energy,Oil & Gas Production
HLM^,Hillman Group Capital Trust Preferred Stock,$27.855,0.085,0.306%,,United States,,3189,,
HMG,HMG/Courtland Properties Inc. Common Stock,$11.94,0.00,0.00%,12026541.00,United States,,18,Consumer Services,Real Estate Investment Trusts
HNW,Pioneer Diversified High Income Fund Inc.,$15.1698,-0.0002,-0.001%,126406758.00,United States,2007,22128,,
HUSA,Houston American Energy Corporation Common Stock,$1.826,0.016,0.884%,18120015.00,United States,,194944,Energy,Oil & Gas Production
HWM^,Howmet Aerospace Inc. $3.75 Preferred Stock,$78.00,0.00,0.00%,,United States,,279,,
IAF,Aberdeen Australia Equity Fund Inc Common Stock,$6.59,-0.03,-0.453%,153573960.00,United States,,28547,,
IBIO,iBio Inc. Common Stock,$1.625,-0.005,-0.307%,354006809.00,United States,,2942186,Health Care,Major Pharmaceuticals
ID,PARTS iD Inc. Class A Common Stock,$7.36,-0.18,-2.387%,244156636.00,United States,2017,20476,Miscellaneous,Diversified Commercial Services
IGC,India Globalization Capital Inc. Common Stock,$1.66,0.17,11.409%,75308096.00,United States,,2192099,Technology,Engineering & Construction
IHT,InnSuites Hospitality Trust Shares of Beneficial Interest,$9.4616,0.2116,2.288%,83792441.00,United States,,319085,Consumer Services,Real Estate Investment Trusts
IMH,Impac Mortgage Holdings Inc. Common Stock ,$2.34,0.10,4.464%,49918481.00,United States,1997,265142,Finance,Finance: Consumer Services
IMO,Imperial Oil Limited Common Stock,$33.96,0.01,0.029%,24929246600.00,Canada,,508674,Energy,Integrated oil Companies
INDO,Indonesia Energy Corporation Limited Ordinary Shares,$5.755,0.2349,4.255%,42747881.00,,2019,7620,Energy,Oil & Gas Production
INFU,InfuSystems Holdings Inc. Common Stock,$19.855,-0.275,-1.366%,406407964.00,United States,,21566,Health Care,Medical/Dental Instruments
INTT,inTest Corporation Common Stock,$16.69,2.06,14.081%,179369616.00,United States,1997,563650,Technology,Semiconductors
INUV,Inuvo Inc.,$0.8711,0.0063,0.728%,103239465.00,United States,,1191092,Technology,Advertising
IOR,Income Opportunity Realty Investors Inc. Common Stock,$12.41,0.00,0.00%,51730018.00,United States,,6,Finance,Diversified Financial Services
ISDR,Issuer Direct Corporation Common Stock,$26.01,-0.23,-0.877%,97953010.00,United States,,5695,Technology,EDP Services
ISR,IsoRay Inc. Common Stock (DE),$0.8612,-0.0046,-0.531%,121829887.00,United States,,755713,Health Care,Medical/Dental Instruments
ITP,IT Tech Packaging Inc. Common Stock,$0.5028,-0.0093,-1.816%,49802290.00,China,,1334646,Basic Industries,Paper
ITRG,Integra Resources Corp. Common Shares,$3.24,-0.07,-2.115%,177594191.00,,,77909,,
JOB,GEE Group Inc. Common Stock,$0.615,0.00,0.00%,69802780.00,United States,,3429917,Technology,Diversified Commercial Services
KIQ,Kelso Technologies Inc Ordinary Shares,$0.7198,-0.0038,-0.525%,39063608.00,Canada,,355743,,
KLR,Kaleyra Inc. Common Stock,$11.9791,-0.3409,-2.767%,375033709.00,United States,2018,384863,Technology,Internet and Information Services
KULR,KULR Technology Group Inc. Common Stock,$2.38,-0.08,-3.252%,224308336.00,United States,,236963,Capital Goods,Electrical Products
LCTX,Lineage Cell Therapeutics Inc. Common Stock,$2.915,0.045,1.568%,437195627.00,United States,,1129801,Health Care,Biotechnology: Biological Products (No Diagnostic Substances)
LEU,Centrus Energy Corp. Class A Common Stock,$26.48,-0.21,-0.787%,366807183.00,United States,2014,55670,,
LGL,LGL Group Inc. (The) Common Stock,$10.6601,-0.2399,-2.201%,56202222.00,United States,,2312,Capital Goods,Industrial Machinery/Components
LNG,Cheniere Energy Inc. Common Stock,$88.84,0.20,0.226%,22524256486.00,United States,,588659,Public Utilities,Oil/Gas Transmission
LODE,Comstock Mining Inc. Common Stock,$3.97,-0.11,-2.696%,168548395.00,United States,,883255,Finance,Real Estate
LOV,Spark Networks Inc. American Depositary Shares (each representing one-tenth of an Ordinary Share),$5.44,0.05,0.928%,141749482.00,United States,2017,46932,Miscellaneous,Other Consumer Services
LSF,Laird Superfood Inc. Common Stock,$32.06,0.21,0.659%,288248382.00,,2020,34140,Consumer Non-Durables,Specialty Foods
LXFR,Luxfer Holdings PLC Ordinary Shares,$22.03,-0.70,-3.08%,631152120.00,United Kingdom,2012,25850,Capital Goods,Metal Fabrications
MAG,MAG Silver Corporation Ordinary Shares,$23.81,0.38,1.622%,2258139067.00,Canada,,429557,Basic Industries,Precious Metals
MCF,Contango Oil & Gas Company Common Stock (TX),$4.64,0.11,2.428%,932971328.00,United States,,760307,Energy,Oil & Gas Production
MHH,Mastech Digital Inc Common Stock,$15.57,-0.22,-1.393%,177981480.00,United States,,5483,Consumer Services,Professional Services
MLSS,Milestone Scientific Inc. Common Stock,$2.13,-0.05,-2.294%,142188565.00,United States,2015,114560,Health Care,Industrial Specialties
MMX,Maverix Metals Inc. Common Shares,$6.07,0.47,8.393%,857185879.00,,,287474,Basic Industries,Precious Metals
MSN,Emerson Radio Corporation Common Stock,$1.245,0.085,7.328%,26198102.00,United States,,80211,Consumer Non-Durables,Consumer Electronics/Appliances
MTA,Metalla Royalty & Streaming Ltd. Common Shares,$10.46,0.00,0.00%,442489254.00,,,445700,Basic Industries,Precious Metals
MTNB,Matinas Biopharma Holdings Inc. Common Stock,$0.9211,0.0473,5.413%,188165967.00,United States,2017,1457853,Health Care,Major Pharmaceuticals
MXC,Mexco Energy Corporation Common Stock,$8.89,0.045,0.509%,18417111.00,United States,,5468,Energy,Oil & Gas Production
MYO,Myomo Inc. Common Stock,$11.61,0.28,2.471%,65062707.00,United States,2017,54394,Health Care,Industrial Specialties
NAK,Northern Dynasty Minerals Ltd. Common Stock,$0.5521,-0.0079,-1.411%,283172199.00,Canada,,3337844,Basic Industries,Precious Metals
NAVB,Navidea Biopharmaceuticals Inc. Common Stock,$2.00,0.03,1.523%,58050824.00,United States,,72854,Health Care,Biotechnology: In Vitro & In Vivo Diagnostic Substances
NBA,New Beginnings Acquisition Corp. Common Stock,$10.0501,-0.0299,-0.297%,149947492.00,,2020,2686,,
NBH,Neuberger Berman Municipal Fund Inc. Common Stock,$15.80,-0.11,-0.691%,297325917.00,United States,2002,13720,,
NBO,Neuberger Berman New York Municipal Fund Inc. Common Stock,$13.41,0.0759,0.569%,68088162.00,United States,2002,1677,,
NBW,Neuberger Berman California Municipal Fund Inc Common Stock,$14.22,-0.03,-0.211%,78935846.00,United States,2002,2935,,
NBY,NovaBay Pharmaceuticals Inc. Common Stock,$0.7447,0.0135,1.846%,31234642.00,United States,2007,442298,Health Care,Major Pharmaceuticals
NEN,New England Realty Associates Limited Partnership Class A Depositary Receipts Evidencing Units of Limited Partnership,$62.00,-2.665,-4.121%,226467152.00,United States,,3480,Consumer Services,Building operators
NES,Nuverra Environmental Solutions Inc. Common Stock,$2.245,0.01,0.447%,35920180.00,United States,2017,1322,Public Utilities,Water Supply
NEWP,New Pacific Metals Corp. Common Shares,$5.4132,-0.0368,-0.675%,832747449.00,,2021,49390,Capital Goods,Medical Specialities
NG,Novagold Resources Inc.,$9.345,-0.375,-3.858%,3096289914.00,Canada,,681718,Basic Industries,Precious Metals
NGD,New Gold Inc.,$2.19,0.01,0.459%,1490733000.00,Canada,,7827603,Basic Industries,Precious Metals
NHC,National HealthCare Corporation Common Stock,$72.82,-0.48,-0.655%,1120928455.00,United States,,15565,Health Care,Hospital/Nursing Management
NHS,Neuberger Berman High Yield Strategies Fund,$13.022,-0.118,-0.898%,254457498.00,United States,,13136,,
NML,Neuberger Berman MLP and Energy Income Fund Inc. Common Stock,$5.31,0.03,0.568%,300858908.00,,2013,87409,,
NNVC,NanoViricides Inc. Common Stock,$4.24,-0.17,-3.855%,48781200.00,United States,,68160,Health Care,Major Pharmaceuticals
NOG,Northern Oil and Gas Inc. Common Stock,$19.12,-0.12,-0.624%,1154904691.00,United States,,312839,Energy,Oil & Gas Production
NRO,Neuberger Berman Real Estate Securities Income Fund Inc. Neuberger Berman Real Estate Securities Income Fund Inc.,$5.1108,-0.0192,-0.374%,242356185.00,United States,2003,71638,,
NTIP,Network-1 Technologies Inc. Common Stock,$3.54,-0.19,-5.094%,85374637.00,United States,,4476,Capital Goods,Telecommunications Equipment
NXE,Nexgen Energy Ltd. Common Shares,$4.48,-0.39,-8.008%,2108663957.00,,,5661703,Basic Industries,Precious Metals
OGEN,Oragenics Inc. Common Stock,$0.7823,-0.0174,-2.176%,90463815.00,United States,,1195494,Health Care,Major Pharmaceuticals
ORLA,Orla Mining Ltd. Common Shares,$4.85,0.255,5.55%,1152782071.00,,2020,208208,Basic Industries,Precious Metals
PCG^A,Pacific Gas & Electric Co. 6% Preferred Stock,$28.8589,0.0789,0.274%,,United States,,2647,,
PCG^B,Pacific Gas & Electric Co. 5 1/2% Preferred Stock,$26.80,0.00,0.00%,,United States,,10,,
PCG^C,Pacific Gas & Electric Co. 5% 1st Preferred Stock,$24.85,-0.9292,-3.604%,,United States,,200,,
PCG^D,Pacific Gas & Electric Co. 5% 1st  Red. Preferred Stock,$24.95,0.00,0.00%,,United States,,6,,
PCG^E,Pacific Gas & Electric Co. 5% 1st A Preferred Stock,$24.58,0.05,0.204%,,United States,,550,,
PCG^H,Pacific Gas & Electric Co. 4.50% 1st Preferred Stock,$22.10,0.05,0.227%,,United States,,150,,
PCG^I,Pacific Gas & Electric Co. 4.36% 1st Preferred Stock,$22.49,-0.449,-1.957%,,United States,,700,,
PED,Pedevco Corp. Common Stock,$1.59,-0.03,-1.852%,126343949.00,United States,,771112,,
PHGE,BiomX Inc. COmmon Stock,$6.145,0.165,2.759%,149487688.00,,2019,358430,Health Care,Major Pharmaceuticals
PLAG,Planet Green Holdings Corp. Common Stock,$1.77,-0.01,-0.562%,42497576.00,China,,44321,,
PLG,Platinum Group Metals Ltd. Ordinary Shares (Canada),$3.9001,0.0501,1.301%,288749414.00,Canada,,286760,Basic Industries,Precious Metals
