Symbol,Name,Last Sale,Net Change,% Change,Market Cap,Country,IPO Year,Volume,Sector,Industry
PLM,Polymet Mining Corporation Ordinary Shares (Canada),$3.6201,0.1401,4.026%,365185986.00,Canada,,232262,Basic Industries,Precious Metals
PLX,Protalix BioTherapeutics Inc. (DE) Common Stock,$2.155,-0.015,-0.691%,97800001.00,Israel,,2018190,Health Care,Biotechnology: Biological Products (No Diagnostic Substances)
PLYM^A,Plymouth Industrial REIT Inc. 7.50% Series A Cumulative Redeemable Preferred Stock,$26.5501,-0.2499,-0.932%,,United States,,1653,,
PRK,Park National Corporation Common Stock,$123.76,-1.12,-0.897%,2022318101.00,United States,,7891,Finance,Major Banks
PTK,PTK Acquisition Corp. Common Stock,$9.93,0.00,0.00%,142743750.00,United States,2020,2013,,
PTN,Palatin Technologies Inc. Common Stock,$0.613,0.0048,0.789%,141020461.00,United States,,658015,Health Care,Major Pharmaceuticals
PW,Power REIT (MD) Common Stock,$40.01,-2.82,-6.584%,132930544.00,United States,,29187,Consumer Services,Real Estate Investment Trusts
PW^A,Power REIT 7.75% Series A Cumulative Perpetual Preferred Stock,$26.00,0.00,0.00%,,United States,,25,,
PZG,Paramount Gold Nevada Corp. Common Stock,$1.06,0.01,0.952%,39958205.00,United States,2015,85870,Basic Industries,Precious Metals
RCG,RENN Fund Inc Common Stock,$2.56,0.00,0.00%,15237007.00,United States,,17510,,
REI,Ring Energy Inc. Common Stock,$2.7317,0.1017,3.867%,271192077.00,United States,,2168683,Energy,Oil & Gas Production
REPX,Riley Exploration Permian Inc. Common Stock,$46.475,-0.075,-0.161%,837550188.00,United States,,45473,Energy,Oil & Gas Production
RHE,Regional Health Properties Inc. Common Stock,$13.00,-0.69,-5.04%,21946847.00,,2017,249527,Health Care,Hospital/Nursing Management
RHE^A,Regional Health Properties Inc. 10.875% Series A Cumulative Redeemable Preferred Stock,$5.775,-0.145,-2.449%,,,,3831,,
RLGT,Radiant Logistics Inc. Common Stock,$7.445,0.065,0.881%,373139484.00,United States,,59904,Transportation,Oil Refining/Marketing
RMED,Ra Medical Systems Inc. Common Stock,$5.96,0.01,0.168%,30346192.00,,2018,1096131,Health Care,Medical/Dental Instruments
RVP,Retractable Technologies Inc. Common Stock,$12.0057,0.0257,0.215%,408243071.00,United States,,352865,Health Care,Medical/Dental Instruments
SACC,Sachem Capital Corp. 6.875% Notes due 2024,$25.20,-0.25,-0.982%,0.00,United States,2019,4057,Consumer Services,Real Estate Investment Trusts
SACH,Sachem Capital Corp. Common Shares,$5.37,0.19,3.668%,136798935.00,United States,2017,767483,Consumer Services,Real Estate Investment Trusts
SBEV,Splash Beverage Group Inc. Common Stock,$3.3101,0.0301,0.918%,88504130.00,,2021,458347,,
SCCB,Sachem Capital Corp. 7.125% Notes due 2024,$25.46,-0.49,-1.888%,0.00,United States,2019,1070,Consumer Services,Real Estate Investment Trusts
SCCC,Sachem Capital Corp. 7.75% Notes due 2025,$25.7877,-0.3123,-1.197%,0.00,United States,2020,1758,Consumer Services,Real Estate Investment Trusts
SDPI,Superior Drilling Products Inc. Common Stock,$0.90,0.0078,0.874%,23186108.00,,2014,108419,Energy,Metal Fabrications
SEB,Seaboard Corporation Common Stock,$3797.76,26.77,0.71%,4408360055.00,United States,1996,771,,
SENS,Senseonics Holdings Inc. Common Stock,$4.315,0.305,7.606%,1847131526.00,United States,,111079523,Health Care,Medical Specialities
SIF,SIFCO Industries Inc. Common Stock,$9.55,0.01,0.105%,57196182.00,United States,,6388,Capital Goods,Office Equipment/Supplies/Services
SILV,SilverCrest Metals Inc. Common Shares,$10.14,0.01,0.099%,1464803755.00,,2018,455080,Capital Goods,Industrial Machinery/Components
SIM,Grupo Simec S.A.B. de C.V. American Depositary Shares,$28.00,2.7899,11.067%,4319275072.00,Mexico,1993,4454,Basic Industries,Aluminum
SMTS,Sierra Metals Inc. Common Stock,$3.37,0.05,1.506%,550752866.00,,,164561,Basic Industries,Precious Metals
SNMP,Evolve Transition Infrastructure LP Common Stock,$0.799,-0.0115,-1.419%,44892117.00,United States,,656106,Energy,Oil & Gas Production
SSY,SunLink Health Systems Inc. Common Stock,$2.9084,-0.0516,-1.743%,20126282.00,United States,,391472,Health Care,Medical/Nursing Services
STXS,Stereotaxis Inc. Common Stock,$8.67,0.32,3.832%,642568111.00,United States,,730196,Health Care,Biotechnology: Electromedical & Electrotherapeutic Apparatus
SVM,Silvercorp Metals Inc. Common Shares,$6.35,0.01,0.158%,1116852034.00,,,538246,Basic Industries,Precious Metals
SVT,Servotronics Inc. Common Stock,$8.36,0.00,0.00%,20720319.00,United States,,20,Consumer Durables,Metal Fabrications
SYN,Synthetic Biologics Inc. Common Stock,$0.6551,0.0048,0.738%,86501067.00,United States,,2134386,Health Care,Major Pharmaceuticals
TGB,Taseko Mines Ltd. Common Stock,$2.37,-0.03,-1.25%,671157987.00,Canada,,792044,Basic Industries,Precious Metals
THM,International Tower Hill Mines Ltd. Ordinary Shares (Canada),$1.0789,0.0189,1.783%,210286440.00,Canada,,93258,Basic Industries,Precious Metals
TKAT,Takung Art Co. Ltd. Common Stock,$20.2839,-0.2161,-1.054%,236558529.00,,,1362929,Consumer Services,Catalog/Specialty Distribution
TMBR,Timber Pharmaceuticals Inc. Common Stock,$1.25,-0.06,-4.58%,46053806.00,United States,2015,1126036,Consumer Durables,Specialty Chemicals
TMP,Tompkins Financial Corporation Common Stock,$81.62,-1.10,-1.33%,1216549120.00,United States,,8906,Finance,Major Banks
TMQ,Trilogy Metals Inc. Common Stock,$2.82,-0.04,-1.399%,406905623.00,Canada,,90401,Basic Industries,Precious Metals
TPHS,Trinity Place Holdings Inc. Common Stock,$2.01,-0.04,-1.951%,65235692.00,,,60084,Consumer Services,Real Estate
TRT,Trio-Tech International Common Stock,$5.70,0.00,0.00%,22304414.00,United States,,11217,Technology,Industrial Machinery/Components
TRX,Tanzanian Gold Corporation Common Stock,$0.5615,0.0115,2.091%,143109817.00,Canada,,711108,Basic Industries,Precious Metals
UAMY,United States Antimony Corporation Common Stock,$0.9615,0.0241,2.571%,101936263.00,United States,,854184,,
UAVS,AgEagle Aerial Systems Inc. Common Stock,$5.785,-0.025,-0.43%,398911189.00,United States,,2110716,,
UEC,Uranium Energy Corp. Common Stock,$3.05,-0.15,-4.688%,711407614.00,Canada,,7384808,Basic Industries,Other Metals and Minerals
UFAB,Unique Fabricating Inc. Common Stock,$3.28,-0.03,-0.906%,32075602.00,United States,2015,23652,Capital Goods,Auto Parts:O.E.M.
URG,Ur Energy Inc Common Shares (Canada),$1.59,-0.07,-4.217%,301128669.00,Canada,,3295869,Basic Industries,Other Metals and Minerals
USAS,Americas Gold and Silver Corporation Common Shares no par value,$1.74,0.01,0.578%,231579125.00,,2017,520677,Basic Industries,Precious Metals
UTG,Reaves Utility Income Fund Common Shares of Beneficial Interest,$35.17,-0.06,-0.17%,1958861380.00,United States,2004,170619,,
UUU,Universal Security Instruments Inc. Common Stock,$7.76,0.27,3.605%,17948003.00,United States,,181459,Miscellaneous,Diversified Manufacture
UUUU,Energy Fuels Inc Ordinary Shares (Canada),$6.48,-0.55,-7.824%,951322702.00,,,5648343,Basic Industries,Mining & Quarrying of Nonmetallic Minerals (No Fuels)
VCF,Delaware Investments Colorado Municipal Income Fund Inc  Common Stock,$14.7738,0.1337,0.913%,71462348.00,United States,1993,5710,,
VFL,Delaware Investments National Municipal Income Fund Common Stock,$14.04,0.00,0.00%,63579340.00,United States,1993,4424,,
VGZ,Vista Gold Corp Common Stock,$1.37,0.18,15.126%,142684025.00,United States,,2156958,Basic Industries,Precious Metals
VHAQ,Viveon Health Acquisition Corp. Common Stock,$9.93,-0.01,-0.101%,249801563.00,,2021,33921,,
VKI,Invesco Advantage Municipal Income Trust II Common Shares of Beneficial Interest (DE),$11.99,-0.04,-0.333%,532254696.00,United States,,57079,,
VMM,Delaware Investments Minnesota Municipal Income Fund II Inc. Common Stock,$13.9402,0.0002,0.001%,160381652.00,United States,1993,6041,,
VNRX,VolitionRX Limited Common Stock,$3.42,-0.13,-3.662%,180893078.00,Singapore,2015,119907,Health Care,Biotechnology: Biological Products (No Diagnostic Substances)
VOLT,Volt Information Sciences Inc. Common Stock,$4.03,0.24,6.332%,87598397.00,United States,,129126,Consumer Services,Movies/Entertainment
WLMS,Williams Industrial Services Group Inc. Common Stock,$6.35,0.15,2.419%,164439606.00,,2021,205659,Capital Goods,Oilfield Services/Equipment
WRN,Western Copper and Gold Corporation Common Stock,$2.41,0.03,1.261%,355730761.00,Canada,2011,462213,Basic Industries,Precious Metals
WTT,Wireless Telecom Group  Inc. Common Stock,$2.02,0.08,4.124%,43753842.00,United States,,77103,Capital Goods,Telecommunications Equipment
WWR,Westwater Resources Inc. Common Stock,$4.77,0.10,2.141%,154244223.00,United States,,724623,Basic Industries,Other Metals and Minerals
WYY,WidePoint Corporation Common Stock,$7.48,0.07,0.945%,67853713.00,United States,,44703,Technology,EDP Services
XPL,Solitario Zinc Corp. Common Stock,$0.6997,-0.0045,-0.639%,40882852.00,United States,,745540,,
XTNT,Xtant Medical Holdings Inc. Common Stock,$1.835,0.055,3.09%,159107870.00,United States,,89837,Health Care,Medical Specialities
XXII,22nd Century Group Inc. Common Stock,$4.705,-0.085,-1.775%,764875900.00,United States,,702266,Consumer Non-Durables,Farming/Seeds/Milling
YCBD,cbdMD Inc. Common Stock,$3.2068,-0.1932,-5.682%,182725276.00,United States,2017,104696,Health Care,Major Pharmaceuticals
YCBD^A,cbdMD Inc. 8.0% Series A Cumulative Convertible Preferred Stock,$8.82,0.18,2.083%,,United States,,3100,,
ZDGE,Zedge Inc. Class B Common Stock ,$17.435,2.205,14.478%,235925207.00,,2016,566439,Technology,Computer Software: Prepackaged Software
ZOM,Zomedica Corp. Common Shares,$0.9643,0.0177,1.87%,939565786.00,United States,2017,20966234,,
