Symbol,Name,Last Sale,Net Change,% Change,Market Cap,Country,IPO Year,Volume,Sector,Industry
AACG,ATA Creativity Global American Depositary Shares,$3.255,0.065,2.038%,103187367.00,China,,141858,Miscellaneous,Service to the Health Industry
AACQ,Artius Acquisition Inc. Class A Common Stock,$9.99,0.00,0.00%,904719375.00,United States,2020,984683,Finance,Business Services
AACQU,Artius Acquisition Inc. Unit ,$10.81,0.01,0.093%,0.00,United States,2020,4226,Basic Industries,Major Chemicals
AACQW,Artius Acquisition Inc Warrant,$2.42,0.01,0.415%,0.00,United States,2020,91710,Basic Industries,Major Chemicals
AAL,American Airlines Group Inc. Common Stock,$23.1113,-0.4187,-1.779%,14823197771.00,United States,,12399843,Transportation,Air Freight/Delivery Services
AAME,Atlantic American Corporation Common Stock,$4.18,-0.10,-2.336%,85337969.00,United States,,46435,Finance,Life Insurance
AAOI,Applied Optoelectronics Inc. Common Stock,$8.895,0.105,1.195%,238938273.00,United States,2013,230589,Technology,Semiconductors
AAON,AAON Inc. Common Stock,$63.78,-0.81,-1.254%,3344314951.00,United States,,24952,Capital Goods,Industrial Machinery/Components
AAPL,Apple Inc. Common Stock,$129.90,2.55,2.002%,2252120466000.00,United States,1980,47685176,Technology,Computer Manufacturing
AAWW,Atlas Air Worldwide Holdings NEW Common Stock,$73.78,-0.45,-0.606%,2140270371.00,United States,,129455,Transportation,Transportation Services
ABCB,Ameris Bancorp Common Stock,$53.94,-0.33,-0.608%,3761313118.00,United States,1994,124442,Finance,Major Banks
ABCL,AbCellera Biologics Inc. Common Shares,$24.855,-1.045,-4.035%,6733862946.00,Canada,2020,2630673,,
ABCM,Abcam plc American Depositary Shares,$18.72,0.25,1.354%,4244717300.00,United Kingdom,2020,20832,Health Care,Biotechnology: Biological Products (No Diagnostic Substances)
ABEO,Abeona Therapeutics Inc. Common Stock,$1.81,-0.01,-0.549%,180805727.00,United States,,406147,Health Care,Major Pharmaceuticals
ABGI,ABG Acquisition Corp. I Class A Ordinary Shares,$9.935,-0.005,-0.05%,192068884.00,United States,2021,1503,Finance,Business Services
ABIO,ARCA biopharma Inc. Common Stock,$3.86,0.18,4.891%,55623152.00,United States,,218001,Health Care,Biotechnology: In Vitro & In Vivo Diagnostic Substances
ABMD,ABIOMED Inc. Common Stock,$304.77,5.58,1.865%,13804855520.00,United States,,150077,Health Care,Medical/Dental Instruments
ABNB,Airbnb Inc. Class A Common Stock,$148.4236,-0.0164,-0.011%,88519687655.00,United States,2020,4131496,Finance,Diversified Commercial Services
ABST,Absolute Software Corporation Common Stock,$14.15,0.25,1.799%,700574806.00,Canada,2020,90576,,
ABTX,Allegiance Bancshares Inc. Common Stock,$40.56,-0.55,-1.338%,818623088.00,United States,2015,13806,Finance,Major Banks
ABUS,Arbutus Biopharma Corporation Common Stock,$3.41,0.13,3.963%,332651464.00,Canada,,760493,,
ACAC,Acies Acquisition Corp. Class A Ordinary Share,$9.995,-0.005,-0.05%,268927969.00,United States,2020,204991,Finance,Business Services
ACACU,Acies Acquisition Corp. Unit,$10.76,0.1622,1.531%,0.00,United States,2020,6600,Finance,Business Services
ACACW,Acies Acquisition Corp. Warrant,$1.95,-0.05,-2.50%,0.00,United States,2020,16540,Finance,Business Services
ACAD,ACADIA Pharmaceuticals Inc. Common Stock,$27.22,-0.20,-0.729%,4360073360.00,United States,1985,492206,Health Care,Major Pharmaceuticals
ACAH,Atlantic Coastal Acquisition Corp. Class A Common Stock,$9.66,-0.0141,-0.146%,416587500.00,United States,2021,2911,,
ACAHU,Atlantic Coastal Acquisition Corp. Unit,$9.90,-0.02,-0.202%,0.00,United States,2021,2405,,
ACAHW,Atlantic Coastal Acquisition Corp. Warrant,$0.8015,0.0518,6.909%,0.00,United States,2021,23346,,
ACB,Aurora Cannabis Inc. Common Shares,$9.5952,-0.2248,-2.289%,1899655230.00,Canada,,2379790,Consumer Durables,Specialty Chemicals
ACBA,Ace Global Business Acquisition Limited Ordinary Shares,$10.00,0.00,0.00%,60540000.00,Hong Kong,2021,1049,Miscellaneous,Business Services
ACBAU,Ace Global Business Acquisition Limited Unit,$10.40,0.0333,0.321%,0.00,Hong Kong,2021,1000,Miscellaneous,Business Services
ACBAW,Ace Global Business Acquisition Limited Warrant,$0.525,-0.025,-4.545%,0.00,Hong Kong,2021,31312,Miscellaneous,Business Services
ACBI,Atlantic Capital Bancshares Inc. Common Stock,$27.4026,-0.6974,-2.482%,557177230.00,United States,,11969,Finance,Major Banks
ACCD,Accolade Inc. Common Stock,$53.92,0.04,0.074%,3163528080.00,United States,2020,203564,,
ACER,Acer Therapeutics Inc. Common Stock (DE),$3.085,-0.015,-0.484%,44147103.00,United States,,36915,Health Care,Biotechnology: Biological Products (No Diagnostic Substances)
ACET,Adicet Bio Inc. Common Stock ,$11.73,-0.02,-0.17%,229788682.00,United States,2018,45926,Health Care,Major Pharmaceuticals
ACEV,ACE Convergence Acquisition Corp. Class A Ordinary Shares,$10.1099,-0.1901,-1.846%,290659625.00,United States,2020,238262,Technology,Semiconductors
ACEVU,ACE Convergence Acquisition Corp. Unit,$11.50,-0.12,-1.033%,0.00,United States,2020,430,Technology,Semiconductors
ACEVW,ACE Convergence Acquisition Corp. Warrant,$2.205,-0.095,-4.13%,0.00,United States,2020,24283,Technology,Semiconductors
ACGL,Arch Capital Group Ltd. Common Stock,$39.10,-0.19,-0.484%,15781506067.00,Bermuda,,576262,Finance,Property-Casualty Insurers
ACGLN,Arch Capital Group Ltd. Depositary Shares each Representing a 1/1000th Interest in a 4.550% Non-Cumulative Preferred Share Series G,$25.385,25.385,,,Bermuda,,63621,,
ACGLO,Arch Capital Group Ltd. Depositary Shares Each Representing 1/1000th Interest in a Share of 5.45% Non-Cumulative Preferred Shares Series F,$26.34,-0.2394,-0.901%,0.00,Bermuda,,6043,Finance,Property-Casualty Insurers
ACGLP,Arch Capital Group Ltd. Depositary Shares Representing Interest in 5.25% Non-Cumulative Preferred Series E Shrs,$25.24,0.0181,0.072%,0.00,Bermuda,,33175,Finance,Property-Casualty Insurers
ACHC,Acadia Healthcare Company Inc. Common Stock,$66.57,-1.23,-1.814%,5973930822.00,United States,,122845,Health Care,Hospital/Nursing Management
ACHL,Achilles Therapeutics plc American Depositary Shares,$12.24,-0.37,-2.934%,497210232.00,United Kingdom,2021,18836,Health Care,Biotechnology: Biological Products (No Diagnostic Substances)
ACHV,Achieve Life Sciences Inc. Common Shares,$8.68,-0.03,-0.344%,82026642.00,United States,,110825,Health Care,Biotechnology: In Vitro & In Vivo Diagnostic Substances
ACIU,AC Immune SA Common Stock,$7.35,-0.33,-4.297%,533997007.00,Switzerland,2016,214945,Health Care,Major Pharmaceuticals
ACIW,ACI Worldwide Inc. Common Stock,$38.79,-0.55,-1.398%,4582440397.00,United States,,88516,Technology,EDP Services
ACKIT,Ackrell SPAC Partners I Co. Subunits,$9.97,-0.01,-0.10%,0.00,United States,2021,100,,
ACKIU,Ackrell SPAC Partners I Co. Units,$10.26,0.00,0.00%,0.00,United States,2020,335,,
ACKIW,Ackrell SPAC Partners I Co. Warrants,$0.62,-0.0277,-4.277%,0.00,United States,2021,2040,Finance,Business Services
ACLS,Axcelis Technologies Inc. Common Stock,$42.02,0.51,1.229%,1411867672.00,United States,2000,71904,Technology,Industrial Machinery/Components
ACMR,ACM Research Inc. Class A Common Stock,$96.00,7.23,8.145%,1822352064.00,United States,2017,277620,Technology,Industrial Machinery/Components
ACNB,ACNB Corporation Common Stock,$28.285,0.065,0.23%,246504341.00,United States,,12652,Finance,Major Banks
ACOR,Acorda Therapeutics Inc. Common Stock,$4.27,0.42,10.909%,47501278.00,United States,2006,1795410,Health Care,Biotechnology: Biological Products (No Diagnostic Substances)
ACQR,Independence Holdings Corp. Class A Ordinary Share,$9.95,-0.04,-0.40%,616786918.00,United States,2021,1710,Finance,Business Services
ACQRU,Independence Holdings Corp. Units,$10.03,0.00,0.00%,0.00,United States,2021,1537,Finance,Business Services
ACQRW,Independence Holdings Corp. Warrant,$0.95,-0.05,-5.00%,0.00,United States,2021,9357,Finance,Business Services
ACRS,Aclaris Therapeutics Inc. Common Stock,$17.97,-0.41,-2.231%,936369169.00,United States,2015,332276,Health Care,Major Pharmaceuticals
ACRX,AcelRx Pharmaceuticals Inc. Common Stock,$1.54,0.00,0.00%,183418618.00,United States,2011,1175565,Consumer Durables,Specialty Chemicals
ACST,Acasti Pharma Inc. Class A Common Stock,$0.5576,0.0052,0.941%,54027279.00,Canada,,3141700,,
ACTC,ArcLight Clean Transition Corp. Class A Ordinary Shares,$18.925,-0.085,-0.447%,656460938.00,United States,2020,1371247,Finance,Business Services
ACTCU,ArcLight Clean Transition Corp. Unit,$21.94,-0.50,-2.228%,0.00,United States,2020,1012,Finance,Business Services
ACTCW,ArcLight Clean Transition Corp. Warrant,$6.41,-0.13,-1.988%,0.00,United States,2020,91550,Capital Goods,Auto Manufacturing
ACTD,ArcLight Clean Transition Corp. II Class A Ordinary Share,$9.9794,0.0794,0.802%,343665588.00,United States,2021,18487,,
ACTDU,ArcLight Clean Transition Corp. II Unit,$10.15,0.08,0.794%,0.00,United States,2021,34199,,
ACTDW,ArcLight Clean Transition Corp. II Warrant,$1.45,0.10,7.407%,0.00,United States,2021,28438,Finance,Business Services
ACTG,Acacia Research Corporation (Acacia Tech) Common Stock,$6.35,-0.08,-1.244%,312924527.00,United States,,84515,Miscellaneous,Multi-Sector Companies
ACVA,ACV Auctions Inc. Class A Common Stock,$24.62,0.33,1.359%,3804522420.00,United States,2021,582417,Technology,EDP Services
ADAG,Adagene Inc. American Depositary Shares,$13.62,0.09,0.665%,592713880.00,China,2021,6022,Health Care,Major Pharmaceuticals
ADAP,Adaptimmune Therapeutics plc American Depositary Shares,$4.45,-0.01,-0.224%,691963519.00,United Kingdom,2015,354315,Health Care,Major Pharmaceuticals
ADBE,Adobe Inc. Common Stock,$554.84,13.58,2.509%,265213520000.00,United States,1986,2369690,Technology,Computer Software: Prepackaged Software
ADER,26 Capital Acquisition Corp. Class A Common Stock,$9.71,0.00,0.00%,333781250.00,United States,2021,3794,,
ADERU,26 Capital Acquisition Corp. Unit,$10.1315,-0.0685,-0.672%,0.00,United States,2021,102378,,
ADERW,26 Capital Acquisition Corp. Warrant,$0.9205,-0.0595,-6.071%,0.00,United States,2021,6499,Finance,Business Services
ADES,Advanced Emissions Solutions Inc. Common Stock,$7.78,0.03,0.387%,146696622.00,United States,,60604,Energy,Coal Mining
ADI,Analog Devices Inc. Common Stock,$168.08,0.48,0.286%,61992428377.00,United States,,1308443,Technology,Semiconductors
ADIL,Adial Pharmaceuticals Inc Common Stock,$2.7401,0.0401,1.485%,49879473.00,United States,2018,38589,Health Care,Major Pharmaceuticals
ADILW,Adial Pharmaceuticals Inc Warrant,$0.70,-0.0002,-0.029%,0.00,United States,2018,20450,Health Care,Major Pharmaceuticals
ADMA,ADMA Biologics Inc Common Stock,$1.8573,0.0373,2.049%,238086596.00,United States,,1272210,Health Care,Major Pharmaceuticals
ADMP,Adamis Pharmaceuticals Corporation Common Stock,$1.01,0.01,1.00%,150375002.00,United States,,3391606,Health Care,Major Pharmaceuticals
ADMS,Adamas Pharmaceuticals Inc. Common Stock,$5.11,0.02,0.393%,232035365.00,United States,2014,82326,Health Care,Major Pharmaceuticals
ADN,Advent Technologies Holdings Inc. Class A Common Stock,$10.35,-0.01,-0.097%,211535453.00,United States,2018,160616,Miscellaneous,Business Services
ADNWW,Advent Technologies Holdings Inc. Warrant,$1.69,0.01,0.595%,0.00,United States,2018,36700,Miscellaneous,Business Services
ADOC,Edoc Acquisition Corp. Class A Ordinary Share,$10.07,0.00,0.00%,118866280.00,United States,2020,30,Finance,Business Services
ADOCR,Edoc Acquisition Corp. Right,$0.38,-0.0199,-4.976%,0.00,United States,2020,1100,Finance,Business Services
ADOCW,Edoc Acquisition Corp. Warrant,$0.3199,-0.0178,-5.271%,0.00,United States,2020,31412,Finance,Business Services
ADP,Automatic Data Processing Inc. Common Stock,$197.67,-1.98,-0.992%,84112206314.00,United States,,372080,Miscellaneous,Business Services
ADPT,Adaptive Biotechnologies Corporation Common Stock,$39.29,0.53,1.367%,5512824730.00,United States,2019,241582,Health Care,Biotechnology: Biological Products (No Diagnostic Substances)
ADSK,Autodesk Inc. Common Stock,$279.74,2.23,0.804%,61546524738.00,United States,,535998,Technology,Computer Software: Prepackaged Software
ADTN,ADTRAN Inc. Common Stock,$21.62,0.27,1.265%,1046315229.00,United States,1994,101259,Capital Goods,Telecommunications Equipment
ADTX,ADiTx Therapeutics Inc. Common Stock,$2.99,0.09,3.103%,43493282.00,United States,2020,129906,Consumer Durables,Specialty Chemicals
ADUS,Addus HomeCare Corporation Common Stock,$90.83,-0.14,-0.154%,1444508910.00,United States,2009,52665,Health Care,Medical/Nursing Services
ADV,Advantage Solutions Inc. Class A Common Stock,$12.26,0.05,0.41%,3904196583.00,United States,2019,122118,Technology,Advertising
ADVM,Adverum Biotechnologies Inc. Common Stock,$3.6585,-0.0615,-1.653%,358294382.00,United States,2014,1069854,Health Care,Major Pharmaceuticals
ADVWW,Advantage Solutions Inc. Warrant,$3.27,-0.01,-0.305%,0.00,United States,2019,760,Technology,Advertising
ADXN,Addex Therapeutics Ltd American Depositary Shares,$10.815,-0.435,-3.867%,78538930.00,Switzerland,,6094,Health Care,Major Pharmaceuticals
ADXS,Advaxis Inc. Common Stock,$0.5048,-0.0108,-2.095%,69642696.00,United States,,3628846,Health Care,Major Pharmaceuticals
AEAC,Authentic Equity Acquisition Corp. Class A ordinary share,$9.699,0.00,0.00%,290970000.00,United States,2021,5,Finance,Business Services
AEACU,Authentic Equity Acquisition Corp. Unit,$10.06,0.01,0.10%,0.00,United States,2021,152,Finance,Business Services
AEACW,Authentic Equity Acquisition Corp. Warrant,$0.81,0.00,0.00%,0.00,United States,2021,7424,Finance,Business Services
AEHL,Antelope Enterprise Holdings Limited Common Stock (0.024 par),$3.26,0.03,0.929%,14363084.00,China,,1009969,Capital Goods,Building Products
AEHR,Aehr Test Systems Common Stock,$2.72,0.04,1.493%,64185826.00,United States,1997,152624,Capital Goods,Electrical Products
AEI,Alset EHome International Inc. Common Stock,$5.3421,-0.1079,-1.98%,45470016.00,United States,2020,1554579,Consumer Services,Building operators
AEIS,Advanced Energy Industries Inc. Common Stock,$106.01,1.46,1.396%,4072431077.00,United States,1995,80823,Consumer Durables,Electrical Products
AEMD,Aethlon Medical Inc. Common Stock,$5.9035,-0.5865,-9.037%,71617023.00,United States,,3872627,Miscellaneous,Diversified Commercial Services
AEP,American Electric Power Company Inc. Common Stock,$84.8058,0.0458,0.054%,42381732472.00,United States,,680813,Public Utilities,Electric Utilities: Central
AEPPL,American Electric Power Company Inc. Corporate Unit,$49.171,-0.089,-0.181%,0.00,United States,,10201,Public Utilities,Electric Utilities: Central
AEPPZ,American Electric Power Company Inc. Corporate Units,$50.72,0.07,0.138%,0.00,United States,,4237,Public Utilities,Electric Utilities: Central
AERI,Aerie Pharmaceuticals Inc. Common Stock,$15.595,0.135,0.873%,731300842.00,United States,2013,180358,Health Care,Biotechnology: Biological Products (No Diagnostic Substances)
AESE,Allied Esports Entertainment Inc. Common Stock,$2.3099,0.0899,4.05%,90408336.00,United States,2017,699940,Consumer Services,Television Services
AEY,ADDvantage Technologies Group Inc. Common Stock,$2.57,0.09,3.629%,31902366.00,United States,,10595,Capital Goods,Recreational Products/Toys
AEYE,AudioEye Inc. Common Stock,$18.0699,-0.1301,-0.715%,197031551.00,United States,,45840,Technology,EDP Services
AEZS,Aeterna Zentaris Inc. Common Stock,$1.03,-0.02,-1.905%,124788399.00,Canada,,1234624,,
AFAQ,AF Acquisition Corp. Class A Common Stock,$9.66,0.00,0.00%,270480000.00,United States,2021,1,,
AFAQU,AF Acquisition Corp. Units,$9.89,-0.01,-0.101%,0.00,United States,2021,3067,,
AFAQW,AF Acquisition Corp. Warrants,$0.6701,0.00,0.00%,0.00,United States,2021,119,Finance,Business Services
AFBI,Affinity Bancshares Inc. Common Stock (MD),$12.8415,-0.1085,-0.838%,88254930.00,United States,2017,2334,Finance,Major Banks
AFCG,AFC Gamma Inc. Common Stock,$24.12,0.41,1.729%,322409073.00,United States,2021,67718,Consumer Services,Real Estate Investment Trusts
AFIB,Acutus Medical Inc. Common Stock,$16.61,0.00,0.00%,467140587.00,United States,2020,39846,Health Care,Biotechnology: Electromedical & Electrotherapeutic Apparatus
AFIN,American Finance Trust Inc. Class A Common Stock,$8.99,-0.10,-1.10%,978533298.00,United States,,350931,Consumer Services,Real Estate Investment Trusts
AFINO,American Finance Trust Inc. 7.375% Series C Cumulative Redeemable Preferred Stock,$25.89,0.10,0.388%,,United States,,43852,Consumer Services,Real Estate Investment Trusts
AFINP,American Finance Trust Inc. 7.50% Series A Cumulative Redeemable Perpetual Preferred Stock,$25.96,0.09,0.348%,0.00,United States,,27627,Consumer Services,Real Estate Investment Trusts
AFMD,Affimed N.V.,$8.38,0.23,2.822%,996826810.00,Germany,2014,410304,Health Care,Major Pharmaceuticals
AFRM,Affirm Holdings Inc. Class A Common Stock,$69.905,1.925,2.832%,18531347067.00,United States,2021,2132477,Technology,EDP Services
AFYA,Afya Limited Class A Common Shares,$25.62,0.37,1.465%,2400519830.00,Brazil,2019,160159,Consumer Services,Other Consumer Services
AGBA,AGBA Acquisition Limited Ordinary Share,$10.72,0.00,0.00%,57224539.00,Hong Kong,2019,12,Finance,Business Services
AGBAR,AGBA Acquisition Limited Right,$0.3239,-0.0063,-1.908%,0.00,Hong Kong,2019,26569,Finance,Business Services
AGBAU,AGBA Acquisition Limited Unit,$9.99,0.00,0.00%,0.00,Hong Kong,2019,10,Finance,Business Services
AGBAW,AGBA Acquisition Limited Warrant,$0.27,0.00,0.00%,0.00,Hong Kong,2019,30,Finance,Business Services
AGC,Altimeter Growth Corp. Class A Ordinary Shares,$11.5229,-0.2171,-1.849%,720181250.00,United States,2020,284004,Finance,Business Services
AGCUU,Altimeter Growth Corp. Unit,$12.24,-0.17,-1.37%,0.00,United States,2020,19525,Finance,Business Services
AGCWW,Altimeter Growth Corp. Warrant,$3.27,0.05,1.553%,0.00,United States,2020,25057,Finance,Business Services
AGEN,Agenus Inc. Common Stock,$5.195,0.015,0.29%,1155581042.00,United States,2000,1395918,Health Care,Biotechnology: Biological Products (No Diagnostic Substances)
AGFS,AgroFresh Solutions Inc. Common Stock,$2.18,0.01,0.461%,115460325.00,United States,2014,28641,,
AGFY,Agrify Corporation Common Stock,$9.95,-0.75,-7.009%,201936583.00,United States,2021,88988,Finance,Diversified Commercial Services
AGGR,Agile Growth Corp. Class A Ordinary Share,$9.69,0.00,0.00%,375487500.00,United States,2021,995,Finance,Business Services
AGGRU,Agile Growth Corp. Units,$9.95,0.00,0.00%,0.00,United States,2021,1,Finance,Business Services
AGGRW,Agile Growth Corp. Warrant.,$0.7501,0.0134,1.819%,0.00,United States,2021,57833,Finance,Business Services
AGIO,Agios Pharmaceuticals Inc. Common Stock,$58.12,0.38,0.658%,3578697328.00,United States,2013,183420,Health Care,Major Pharmaceuticals
AGLE,Aeglea BioTherapeutics Inc. Common Stock,$6.64,0.04,0.606%,325521558.00,United States,2016,49034,Health Care,Major Pharmaceuticals
AGMH,AGM Group Holdings Inc. Class A Ordinary Shares,$13.47,0.97,7.76%,389162511.00,Hong Kong,2018,249,Technology,EDP Services
AGNC,AGNC Investment Corp. Common Stock,$17.5753,-0.1347,-0.761%,9225401723.00,United States,2008,8354828,Consumer Services,Real Estate Investment Trusts
AGNCM,AGNC Investment Corp. Depositary Shares rep 6.875% Series D Fixed-to-Floating Cumulative Redeemable Preferred Stock,$26.23,0.08,0.306%,0.00,United States,,6916,Consumer Services,Real Estate Investment Trusts
AGNCN,AGNC Investment Corp. Depositary Shares Each Representing a 1/1000th Interest in a Share of 7.00% Series C Fixed-To-Floating Rate Cumulative Redeemable Preferred Stock,$26.4395,0.1895,0.722%,0.00,United States,,22895,Consumer Services,Real Estate Investment Trusts
AGNCO,AGNC Investment Corp. Depositary Shares each representing a 1/1000th interest in a share of 6.50% Series E Fixed-to-Floating Cumulative Redeemable Preferred Stock,$25.40,0.03,0.118%,0.00,United States,,28091,Consumer Services,Real Estate Investment Trusts
AGNCP,AGNC Investment Corp. Depositary Shares Each Representing a 1/1000th Interest in a Share of 6.125% Series F Fixed-to-Floating Rate Cumulative Redeemable Preferred Stock,$25.14,-0.01,-0.04%,0.00,United States,,27338,Consumer Services,Real Estate Investment Trusts
AGRX,Agile Therapeutics Inc. Common Stock,$1.545,0.005,0.325%,136367480.00,United States,2014,388280,Health Care,Major Pharmaceuticals
AGTC,Applied Genetic Technologies Corporation Common Stock,$4.31,0.05,1.174%,184273154.00,United States,2014,308797,Health Care,Biotechnology: Biological Products (No Diagnostic Substances)
AGYS,Agilysys Inc. Common Stock,$56.49,0.20,0.355%,1349805672.00,United States,,25471,Technology,Computer Software: Prepackaged Software
AHAC,Alpha Healthcare Acquisition Corp. Class A Common Stock,$10.6221,-0.4779,-4.305%,136547096.00,United States,2020,136635,,
AHACU,Alpha Healthcare Acquisition Corp. Unit,$12.64,-0.16,-1.25%,0.00,United States,2020,780,,
AHACW,Alpha Healthcare Acquisition Corp. Warrant,$3.35,-0.14,-4.011%,0.00,United States,2020,54380,Finance,Business Services
AHCO,AdaptHealth Corp. Class A Common Stock,$27.63,0.42,1.544%,3571027580.00,United States,2018,203438,Health Care,Biotechnology: Electromedical & Electrotherapeutic Apparatus
AHPI,Allied Healthcare Products Inc. Common Stock,$4.2434,0.0134,0.317%,17031043.00,United States,1992,47153,Health Care,Industrial Specialties
AIH,Aesthetic Medical International Holdings Group Ltd. American Depositary Shares,$8.438,-0.222,-2.564%,199118996.00,China,2019,52691,Health Care,Medical Specialities
AIHS,Senmiao Technology Limited Common Stock,$1.0191,-0.0309,-2.943%,44186971.00,China,2018,536862,Finance,Finance: Consumer Services
AIKI,AIkido Pharma Inc. Common Stock,$1.10,0.01,0.917%,98484261.00,United States,,1080909,Consumer Durables,Specialty Chemicals
AIMC,Altra Industrial Motion Corp. Common Stock,$65.585,-0.455,-0.689%,4249289009.00,United States,2006,117360,Capital Goods,Industrial Machinery/Components
AINV,Apollo Investment Corporation Common Stock,$15.14,0.05,0.331%,988023925.00,United States,2004,356702,Finance,Finance/Investors Services
AIRG,Airgain Inc. Common Stock,$22.185,2.885,14.948%,233757932.00,United States,2016,135197,Technology,Radio And Television Broadcasting And Communications Equipment
AIRT,Air T Inc. Common Stock,$23.17,-0.39,-1.655%,66772534.00,United States,,347,Transportation,Air Freight/Delivery Services
AIRTP,Air T Inc. Air T Funding Alpha Income Trust Preferred Securities,$24.92,0.25,1.013%,0.00,United States,,5740,Transportation,Air Freight/Delivery Services
AIRTW,Air T Inc. Air T Funding Warrants to Purchase Alpha Income Trust Preferred Expiring 08/30/2021,$0.1298,0.0058,4.677%,0.00,United States,,19817,Transportation,Air Freight/Delivery Services
AKAM,Akamai Technologies Inc. Common Stock,$117.25,-1.20,-1.013%,19110775066.00,United States,1999,437218,Miscellaneous,Business Services
AKBA,Akebia Therapeutics Inc. Common Stock,$3.615,-0.055,-1.499%,578816314.00,United States,2014,1279810,Health Care,Major Pharmaceuticals
AKIC,Sports Ventures Acquisition Corp. Class A Ordinary Shares,$9.73,0.03,0.309%,286159300.00,United States,2021,3951,Finance,Business Services
AKICU,Sports Ventures Acquisition Corp. Unit,$9.95,0.02,0.201%,0.00,United States,2021,603,Finance,Business Services
AKICW,Sports Ventures Acquisition Corp. Warrant,$0.8301,0.0591,7.665%,0.00,United States,2021,1010,Finance,Business Services
AKRO,Akero Therapeutics Inc. Common Stock,$29.80,0.83,2.865%,1037817124.00,United States,2019,66416,Health Care,Major Pharmaceuticals
AKTS,Akoustis Technologies Inc. Common Stock,$10.9958,0.8758,8.654%,553904562.00,United States,,463804,Public Utilities,Telecommunications Equipment
AKTX,Akari Therapeutics plc ADR (0.01 USD),$1.7801,0.0001,0.006%,70580591.00,United Kingdom,,378670,Health Care,Major Pharmaceuticals
AKU,Akumin Inc. Common Shares,$2.95,-0.05,-1.667%,209902610.00,Canada,,11696,,
AKUS,Akouos Inc. Common Stock,$13.77,0.77,5.923%,474366889.00,United States,2020,90635,Consumer Durables,Specialty Chemicals
AKYA,Akoya BioSciences Inc. Common Stock,$20.06,0.12,0.602%,744437152.00,United States,2021,48257,Capital Goods,Medical Specialities
ALAC,Alberton Acquisition Corporation Ordinary Shares,$11.1558,-0.0442,-0.395%,51486672.00,Hong Kong,2018,4772,Finance,Business Services
ALACR,Alberton Acquisition Corporation Rights exp April 26 2021,$0.48,-0.0188,-3.769%,0.00,Hong Kong,2018,12654,Finance,Business Services
ALACW,Alberton Acquisition Corporation Warrant,$0.3825,-0.0135,-3.409%,0.00,Hong Kong,2018,14062,Finance,Business Services
ALBO,Albireo Pharma Inc. Common Stock,$34.43,1.13,3.393%,660874519.00,United States,,91754,Health Care,Major Pharmaceuticals
ALCO,Alico Inc. Common Stock,$34.1586,2.3286,7.316%,256904713.00,United States,,60421,Consumer Non-Durables,Farming/Seeds/Milling
ALDX,Aldeyra Therapeutics Inc. Common Stock,$12.34,0.00,0.00%,711169045.00,United States,2014,350423,Health Care,Major Pharmaceuticals
ALEC,Alector Inc. Common Stock,$20.67,1.05,5.352%,1648788272.00,United States,2019,257221,Health Care,Major Pharmaceuticals
ALF,ALFI Inc. Common Stock,$3.409,-0.101,-2.877%,42118856.00,United States,2021,173405,Technology,EDP Services
ALFIW,ALFI Inc. Warrant,$0.5703,-0.0295,-4.918%,0.00,United States,2021,3665,,
ALGM,Allegro MicroSystems Inc. Common Stock,$28.04,0.57,2.075%,5316194534.00,United States,2020,266692,Technology,Semiconductors
ALGN,Align Technology Inc. Common Stock,$605.19,-6.35,-1.038%,47892663824.00,United States,2001,182035,Health Care,Industrial Specialties
ALGS,Aligos Therapeutics Inc. Common Stock,$31.72,-1.88,-5.595%,1210235047.00,United States,2020,70228,Health Care,Major Pharmaceuticals
ALGT,Allegiant Travel Company Common Stock,$206.21,-4.82,-2.284%,3705288303.00,United States,2006,65765,Transportation,Air Freight/Delivery Services
ALHC,Alignment Healthcare Inc. Common Stock,$24.83,1.23,5.212%,4650008007.00,United States,2021,187462,Health Care,Medical Specialities
ALIM,Alimera Sciences Inc. Common Stock,$10.09,-0.21,-2.039%,69777032.00,United States,2010,6687,Health Care,Major Pharmaceuticals
ALJJ,ALJ Regional Holdings Inc. Common Stock,$1.66,0.00,0.00%,70252940.00,United States,,18483,Miscellaneous,Business Services
