Symbol,Name,Last Sale,Net Change,% Change,Market Cap,Country,IPO Year,Volume,Sector,Industry
PTSI,P.A.M. Transportation Services Inc. Common Stock,$58.60,-0.05,-0.085%,335557840.00,United States,1986,1899,Transportation,Trucking Freight/Courier Services
PTVE,Pactiv Evergreen Inc. Common stock,$15.37,0.05,0.326%,2722914003.00,United States,2020,37839,Consumer Durables,Containers/Packaging
PUBM,PubMatic Inc. Class A Common Stock,$35.475,2.825,8.652%,1696645229.00,United States,2020,1423911,Technology,Computer Software: Prepackaged Software
PUCK,Goal Acquisitions Corp. Common Stock,$9.66,0.02,0.207%,320337675.00,United States,2021,19154,,
PUCKU,Goal Acquisitions Corp. Unit,$10.32,0.02,0.194%,0.00,United States,2021,2644,,
PUCKW,Goal Acquisitions Corp. Warrant,$0.69,-0.0001,-0.014%,0.00,United States,2021,66738,Finance,Business Services
PULM,Pulmatrix Inc. Common Stock,$1.12,-0.02,-1.754%,62998949.00,United States,2014,445572,Health Care,Major Pharmaceuticals
PUYI,Puyi Inc. American Depository Shares,$5.70,-0.09,-1.554%,343793653.00,China,2019,4838,Finance,Investment Managers
PVAC,Penn Virginia Corporation Common Stock,$24.21,-0.29,-1.184%,916540485.00,United States,,124372,Energy,Oil & Gas Production
PVBC,Provident Bancorp Inc. (MD) Common Stock,$16.38,-0.10,-0.607%,300329626.00,United States,2015,12787,Finance,Major Banks
PWFL,PowerFleet Inc. Common Stock,$7.34,0.45,6.531%,264131911.00,United States,,258247,Capital Goods,Telecommunications Equipment
PWOD,Penns Woods Bancorp Inc. Common Stock,$24.68,-0.03,-0.121%,174261260.00,United States,,9045,Finance,Major Banks
PXLW,Pixelworks Inc.  Common Stock,$3.68,0.12,3.371%,192141709.00,United States,2000,203731,Technology,Semiconductors
PXS,Pyxis Tankers Inc. Common Stock,$0.8951,-0.0319,-3.441%,19298253.00,Greece,,434393,Transportation,Marine Transportation
PXSAP,Pyxis Tankers Inc. 7.75% Series A Cumulative Convertible Preferred Shares,$24.30,0.80,3.404%,0.00,Greece,,233,Transportation,Marine Transportation
PXSAW,Pyxis Tankers Inc. Warrant,$0.33,0.00,0.00%,0.00,Greece,,62,Transportation,Marine Transportation
PYPD,PolyPid Ltd. Ordinary Shares,$9.10,-0.18,-1.94%,170580792.00,Israel,2020,6721,Health Care,Medical/Dental Instruments
PYPL,PayPal Holdings Inc. Common Stock,$273.175,1.725,0.635%,320906336151.00,United States,,2563357,Miscellaneous,Business Services
PYR,PyroGenesis Canada Inc. Common Shares,$5.87,0.36,6.534%,978549281.00,Canada,,274948,,
PZZA,Papa John's International Inc. Common Stock,$101.84,-0.74,-0.721%,3721026865.00,United States,1993,89187,Consumer Services,Restaurants
QADA,QAD Inc. Class A Common Stock,$78.79,-0.21,-0.266%,1631892177.00,United States,,26727,Technology,Computer Software: Prepackaged Software
QADB,QAD Inc. Class B Common Stock,$50.50,0.00,0.00%,1045951960.00,United States,,97,Technology,Computer Software: Prepackaged Software
QCOM,QUALCOMM Incorporated Common Stock,$136.54,1.92,1.426%,154017120000.00,United States,1991,4428532,Technology,Computer peripheral equipment
QCRH,QCR Holdings Inc. Common Stock,$46.51,-0.59,-1.253%,737040156.00,United States,,17729,Finance,Major Banks
QDEL,Quidel Corporation Common Stock,$115.73,0.96,0.836%,4924405936.00,United States,,214051,Health Care,Biotechnology: In Vitro & In Vivo Diagnostic Substances
QELL,Qell Acquisition Corp. Class A Ordinary Shares,$9.97,0.04,0.403%,472951875.00,United States,2020,155008,Finance,Business Services
QELLU,Qell Acquisition Corp. Unit,$10.61,0.1008,0.959%,0.00,United States,2020,1163,Finance,Business Services
QELLW,Qell Acquisition Corp. Warrant,$1.645,0.045,2.813%,0.00,United States,2020,107856,Finance,Business Services
QFIN,360 DigiTech Inc. American Depositary Shares,$41.7271,1.3771,3.413%,6359043173.00,China,2018,4066547,Finance,Finance: Consumer Services
QH,Quhuo Limited American Depository Shares,$4.44,0.1599,3.736%,232631624.00,China,2020,154306,Miscellaneous,Business Services
QIPT,Quipt Home Medical Corp. Common Shares,$6.02,-0.10,-1.634%,184866362.00,United States,,62428,Capital Goods,Office Equipment/Supplies/Services
QIWI,QIWI plc American Depositary Shares,$11.16,0.07,0.631%,699876801.00,Cyprus,2013,136729,Miscellaneous,Business Services
QK,Q&K International Group Limited American Depositary Shares,$1.71,-0.10,-5.525%,92701376.00,China,2019,987905,Finance,Real Estate
QLGN,Qualigen Therapeutics Inc. Common Stock,$2.20,-0.04,-1.786%,63432730.00,United States,2015,253509,Health Care,Biotechnology: Commercial Physical & Biological Resarch
QLI,Qilian International Holding Group Ltd. Ordinary Shares,$4.47,-0.12,-2.614%,159802500.00,China,2021,35469,Health Care,Major Pharmaceuticals
QLYS,Qualys Inc. Common Stock,$100.48,-2.39,-2.323%,3932976806.00,United States,2012,221671,Technology,EDP Services
QMCO,Quantum Corporation Common Stock,$7.72,0.18,2.387%,440711339.00,United States,,285562,Technology,Electronic Components
QNST,QuinStreet Inc. Common Stock,$17.78,-0.08,-0.448%,953354194.00,United States,2010,73682,Technology,Advertising
QQQX,Nuveen NASDAQ 100 Dynamic Overwrite Fund Shares of Beneficial Interest,$29.01,-0.1115,-0.383%,1220333210.00,United States,,104966,Finance,Finance Companies
QRHC,Quest Resource Holding Corporation Common Stock,$6.315,0.435,7.398%,118219869.00,United States,,179412,Technology,Diversified Commercial Services
QRTEA,Qurate Retail Inc. Series A Common Stock ,$13.47,-0.23,-1.679%,5545362049.00,United States,,1547255,Consumer Services,Catalog/Specialty Distribution
QRTEB,Qurate Retail Inc. Series B Common Stock ,$13.77,-0.1868,-1.338%,5668866772.00,United States,,1314,Consumer Services,Catalog/Specialty Distribution
QRTEP,Qurate Retail Inc. 8.0% Fixed Rate Cumulative Redeemable Preferred Stock,$108.4288,-0.3112,-0.286%,0.00,United States,,5213,Consumer Services,Catalog/Specialty Distribution
QRVO,Qorvo Inc. Common Stock,$185.15,1.84,1.004%,20845448242.00,United States,,236435,Capital Goods,Industrial Machinery/Components
QSI,Quantum-Si Incorporated Class A Common Stock,$9.00,-0.75,-7.692%,0.00,United States,2020,705119,,
QSIAW,Quantum-Si Incorporated Warrant,$2.41,-0.25,-9.398%,0.00,United States,2020,111667,,
QTNT,Quotient Limited Ordinary Shares,$4.415,0.135,3.154%,448243047.00,Switzerland,2014,299311,Health Care,Biotechnology: In Vitro & In Vivo Diagnostic Substances
QTRX,Quanterix Corporation Common Stock,$67.67,1.15,1.729%,2458897587.00,United States,2017,148389,Health Care,Industrial Specialties
QTT,Qutoutiao Inc. American Depositary Shares,$2.06,0.03,1.478%,592233009.00,China,2018,1184567,Technology,Computer Software: Prepackaged Software
QUIK,QuickLogic Corporation Common Stock,$7.22,0.50,7.44%,82671058.00,United States,1999,85102,Technology,Semiconductors
QUMU,Qumu Corporation Common Stock,$3.80,0.00,0.00%,66848737.00,United States,,382565,Technology,Computer Software: Prepackaged Software
QURE,uniQure N.V. Ordinary Shares,$34.89,-1.17,-3.245%,1602313795.00,Netherlands,2014,182654,Health Care,Major Pharmaceuticals
RAAC,Revolution Acceleration Acquisition Corp Class A Common Stock,$10.03,0.01,0.10%,384483330.00,United States,2021,250909,,
RAACU,Revolution Acceleration Acquisition Corp Unit,$10.80,0.06,0.559%,0.00,United States,2020,100,,
RAACW,Revolution Acceleration Acquisition Corp Warrant,$2.1701,-0.0649,-2.904%,0.00,United States,2021,7085,Finance,Business Services
RACA,Therapeutics Acquisition Corp. Class A Common Stock,$10.28,-0.135,-1.296%,183702572.00,United States,2020,1489,,
RACB,Research Alliance Corp. II Class A Common Stock,$9.96,0.01,0.101%,191097540.00,United States,2021,2301,,
RADA,RADA Electronic Industries Ltd. Ordinary Shares,$12.20,0.70,6.087%,530517793.00,Israel,,607981,,
RADI,Radius Global Infrastructure Inc. Class A Common Stock,$15.57,0.09,0.581%,953113004.00,United States,,251862,Consumer Services,Telecommunications Equipment
RAIL,FreightCar America Inc. Common Stock,$6.12,0.02,0.328%,95116550.00,United States,2005,887549,Capital Goods,Railroads
RAIN,Rain Therapeutics Inc. Common Stock,$20.16,0.46,2.335%,533890426.00,United States,2021,52832,Health Care,Major Pharmaceuticals
RAMMU,Aries I Acquisition Corporation Unit,$10.06,-0.02,-0.198%,0.00,Cayman Islands,2021,23220,Finance,Business Services
RAND,Rand Capital Corporation Common Stock,$18.29,0.03,0.164%,47227871.00,United States,,1277,Finance,Finance/Investors Services
RAPT,RAPT Therapeutics Inc. Common Stock,$37.41,18.84,101.454%,935586952.00,United States,2019,24102443,Health Care,Major Pharmaceuticals
RARE,Ultragenyx Pharmaceutical Inc. Common Stock,$102.34,0.63,0.619%,6906182895.00,United States,2014,355522,Health Care,Major Pharmaceuticals
RAVE,Rave Restaurant Group Inc. Common Stock,$1.4217,-0.0083,-0.58%,25597572.00,United States,,101146,Consumer Services,Restaurants
RAVN,Raven Industries Inc. Common Stock,$43.20,-0.27,-0.621%,1551641918.00,United States,,48537,Capital Goods,Office Equipment/Supplies/Services
RBB,RBB Bancorp Common Stock,$24.05,0.05,0.208%,470711987.00,United States,2017,17949,Finance,Commercial Banks
RBBN,Ribbon Communications Inc. Common Stock,$8.215,0.135,1.671%,1210623758.00,United States,,246551,Technology,EDP Services
RBCAA,Republic Bancorp Inc. Class A Common Stock,$47.04,-0.46,-0.968%,978016966.00,United States,1998,31574,Finance,Major Banks
RBCN,Rubicon Technology Inc. Common Stock,$9.9969,0.1469,1.491%,24406882.00,United States,2007,714,Technology,Semiconductors
RBKB,Rhinebeck Bancorp Inc. Common Stock,$10.72,0.12,1.132%,119348869.00,United States,2019,6712,Finance,Major Banks
RBNC,Reliant Bancorp Inc. Common Stock,$28.42,-0.74,-2.538%,466278982.00,United States,,5848,Finance,Major Banks
RCAT,Red Cat Holdings Inc. Common Stock,$3.475,0.075,2.206%,117694949.00,United States,,225230,Technology,Retail: Computer Software & Peripheral Equipment
RCEL,Avita Therapeutics Inc. Common Stock,$19.2801,0.3401,1.796%,478973269.00,Australia,,77394,Health Care,Medical Specialities
RCHG,Recharge Acquisition Corp. Class A Common Stock,$9.82,-0.01,-0.102%,245991000.00,United States,2020,82018,,
RCHGU,Recharge Acquisition Corp. Unit,$10.15,-0.01,-0.098%,0.00,United States,2020,58085,,
RCHGW,Recharge Acquisition Corp. Warrant,$0.7006,0.0007,0.10%,0.00,United States,2020,36816,Finance,Business Services
RCII,Rent-A-Center Inc. Common Stock,$62.60,-0.99,-1.557%,4150965185.00,United States,1995,467760,Technology,Diversified Commercial Services
RCKT,Rocket Pharmaceuticals Inc. Common Stock,$46.90,0.72,1.559%,2973317143.00,United States,2015,114335,Health Care,Major Pharmaceuticals
RCKY,Rocky Brands Inc. Common Stock,$53.315,-1.465,-2.674%,388316284.00,United States,1993,40245,Consumer Non-Durables,Shoe Manufacturing
RCLF,Rosecliff Acquisition Corp I Class A Common Stock,$9.6908,-0.029,-0.298%,306471550.00,United States,2021,2073,,
RCLFU,Rosecliff Acquisition Corp I Unit,$9.89,-0.0105,-0.106%,0.00,United States,2021,282,,
RCLFW,Rosecliff Acquisition Corp I Warrants,$0.6613,0.0272,4.29%,0.00,United States,2021,666,Finance,Business Services
RCM,R1 RCM Inc. Common Stock,$22.09,0.03,0.136%,6156139103.00,United States,,412344,Consumer Services,Other Consumer Services
RCMT,RCM Technologies Inc. Common Stock,$3.78,-0.03,-0.787%,41916738.00,United States,,24543,Consumer Services,Military/Government/Technical
RCON,Recon Technology Ltd. Class A Ordinary Shares,$4.9701,-1.2699,-20.351%,35798795.00,China,2009,23092888,Energy,Oilfield Services/Equipment
RDCM,Radcom Ltd. Ordinary Shares,$10.115,0.095,0.948%,141040080.00,Israel,1997,6888,Technology,Computer peripheral equipment
RDFN,Redfin Corporation Common Stock,$61.24,0.27,0.443%,6371502134.00,United States,2017,343839,Finance,Real Estate
RDHL,Redhill Biopharma Ltd. American Depositary Shares,$7.26,-0.06,-0.82%,338804874.00,Israel,,83497,Health Care,Major Pharmaceuticals
RDI,Reading International Inc Class A Common Stock,$6.4705,0.1705,2.706%,141117742.00,United States,,15747,Consumer Services,Movies/Entertainment
RDIB,Reading International Inc Class B Common Stock,$23.50,-0.95,-3.885%,512520971.00,United States,,1390,Consumer Services,Movies/Entertainment
RDNT,RadNet Inc. Common Stock,$30.98,-0.29,-0.927%,1632647208.00,United States,,145724,Health Care,Medical Specialities
RDUS,Radius Health Inc. Common Stock,$18.74,-0.07,-0.372%,885327430.00,United States,2014,48849,Health Care,Major Pharmaceuticals
RDVT,Red Violet Inc. Common Stock ,$21.90,-0.34,-1.529%,268094369.00,United States,,25241,Technology,Computer Software: Prepackaged Software
RDWR,Radware Ltd. Ordinary Shares,$30.15,0.18,0.601%,1372878441.00,Israel,1999,211325,Technology,EDP Services
REAL,The RealReal Inc. Common Stock,$20.6555,0.3155,1.551%,1875719242.00,United States,2019,769256,Consumer Services,Catalog/Specialty Distribution
REDU,RISE Education Cayman Ltd American Depositary Shares,$3.435,0.085,2.537%,194018782.00,China,2017,8144,Miscellaneous,Service to the Health Industry
REED,Reeds Inc. Common Stock,$1.058,0.038,3.725%,99012274.00,United States,,428625,Consumer Non-Durables,Beverages (Production/Distribution)
REFR,Research Frontiers Incorporated Common Stock,$2.38,-0.06,-2.459%,75327942.00,United States,,39908,Capital Goods,Industrial Machinery/Components
REG,Regency Centers Corporation Common Stock,$66.97,-0.635,-0.939%,11375668855.00,United States,1993,256773,Consumer Services,Real Estate Investment Trusts
REGI,Renewable Energy Group Inc. Common Stock,$70.01,3.20,4.79%,3336851065.00,United States,2012,485813,Basic Industries,Major Chemicals
REGN,Regeneron Pharmaceuticals Inc. Common Stock,$527.135,1.585,0.302%,56162968649.00,United States,1991,221026,Health Care,Major Pharmaceuticals
REKR,Rekor Systems Inc. Common Stock,$10.30,-0.46,-4.275%,422243453.00,United States,,347618,Technology,EDP Services
RELI,Reliance Global Group Inc. Common Stock,$3.8101,-0.0299,-0.779%,41642541.00,United States,,12474,Finance,Specialty Insurers
RELIW,Reliance Global Group Inc. Series A Warrants,$0.54,0.00,0.00%,0.00,United States,,1,Consumer Services,Broadcasting
RELL,Richardson Electronics Ltd. Common Stock,$8.8477,0.0277,0.314%,116857360.00,United States,1983,18363,Technology,Electronic Components
REPH,Recro Pharma Inc. Common Stock,$2.21,-0.03,-1.339%,102454449.00,United States,2014,465422,Health Care,Major Pharmaceuticals
REPL,Replimune Group Inc. Common Stock,$34.495,0.495,1.456%,1607776006.00,United States,2018,129693,Health Care,Major Pharmaceuticals
RESN,Resonant Inc. Common Stock,$4.08,0.38,10.27%,246526342.00,United States,2014,1989898,Technology,Semiconductors
RETA,Reata Pharmaceuticals Inc. Class A Common Stock,$145.08,-0.89,-0.61%,5263184965.00,United States,2016,124013,Health Care,Major Pharmaceuticals
RETO,ReTo Eco-Solutions Inc. Common Shares,$1.2586,0.0486,4.017%,31634911.00,China,2017,186108,Capital Goods,Multi-Sector Companies
REVH,Revolution Healthcare Acquisition Corp. SAIL Class A Common Stock,$9.875,-0.015,-0.152%,570281250.00,United States,2021,4314,,
REVHU,Revolution Healthcare Acquisition Corp. SAIL Units,$10.10,0.05,0.498%,0.00,United States,2021,3026,,
REVHW,Revolution Healthcare Acquisition Corp. SAIL Warrant.,$1.30,-0.02,-1.515%,0.00,United States,2021,273353,,
REYN,Reynolds Consumer Products Inc. Common Stock,$30.30,-0.36,-1.174%,6355685641.00,United States,2020,90490,Capital Goods,Office Equipment/Supplies/Services
RFIL,RF Industries Ltd. Common Stock,$8.03,0.23,2.949%,80078822.00,United States,,29509,Capital Goods,Electrical Products
RGCO,RGC Resources Inc. Common Stock,$23.05,-0.09,-0.389%,189673125.00,United States,,6442,Public Utilities,Oil & Gas Production
RGEN,Repligen Corporation Common Stock,$195.21,3.69,1.927%,10717900808.00,United States,1986,125977,Health Care,Medical/Dental Instruments
RGLD,Royal Gold Inc. Common Stock,$122.785,-0.075,-0.061%,8055493611.00,United States,,163937,,
RGLS,Regulus Therapeutics Inc. Common Stock,$1.0099,-0.0301,-2.894%,75665404.00,United States,2012,5002590,Health Care,Major Pharmaceuticals
RGNX,REGENXBIO Inc. Common Stock,$37.575,-0.105,-0.279%,1597289427.00,United States,2015,47675,Health Care,Biotechnology: Biological Products (No Diagnostic Substances)
RGP,Resources Connection Inc. Common Stock,$15.01,-0.17,-1.12%,492673560.00,United States,,18274,Miscellaneous,Business Services
RIBT,RiceBran Technologies Common Stock,$1.12,-0.02,-1.754%,50906202.00,United States,,136869,Consumer Non-Durables,Specialty Foods
RICK,RCI Hospitality Holdings Inc. Common Stock,$69.37,-0.20,-0.287%,624323757.00,United States,1995,28959,Consumer Services,Restaurants
RIDE,Lordstown Motors Corp. Class A Common Stock,$9.421,-1.989,-17.432%,1663554301.00,United States,2019,29327402,Capital Goods,Construction/Ag Equipment/Trucks
RIGL,Rigel Pharmaceuticals Inc. Common Stock,$4.305,0.285,7.09%,732557454.00,United States,2000,1557760,Health Care,Major Pharmaceuticals
RILY,B. Riley Financial Inc. Common Stock,$68.49,3.01,4.597%,1862579317.00,United States,,251231,Finance,Investment Managers
RILYG,B. Riley Financial Inc. 7.25% Senior Notes due 2027,$25.385,-0.005,-0.02%,0.00,United States,,4889,Miscellaneous,Business Services
RILYH,B. Riley Financial Inc. 7.375% Senior Notes due 2023,$25.78,0.0373,0.145%,0.00,United States,,650,Miscellaneous,Business Services
RILYI,B. Riley Financial Inc. 6.875% Senior Notes due 2023,$25.72,-0.0763,-0.296%,0.00,United States,,168,Miscellaneous,Business Services
RILYK,B. Riley Financial Inc. 5.50% Senior Notes Due 2026,$25.095,-0.035,-0.139%,0.00,United States,,91081,Miscellaneous,Business Services
RILYL,B. Riley Financial Inc. Depositary Shares each representing 1/1000th in a share of 7.375% Series B Cumulative Perpetual Preferred Stock par value $0.0001,$27.565,0.025,0.091%,0.00,United States,,1578,Finance,Investment Managers
RILYM,B. Riley Financial Inc. 6.375% Senior Notes due 2025,$25.61,0.01,0.039%,0.00,United States,,1153,Miscellaneous,Business Services
RILYN,B. Riley Financial Inc. 6.50% Senior Notes Due 2026,$26.10,-0.04,-0.153%,0.00,United States,,2055,Miscellaneous,Business Services
RILYO,B. Riley Financial Inc. 6.75% Senior Notes due 2024,$25.77,0.05,0.194%,0.00,United States,,1318,Miscellaneous,Business Services
RILYP,B. Riley Financial Inc. Depositary Shares each representing a 1/1000th fractional interest in a share of Series A Cumulative Perpetual Preferred Stock,$26.795,0.045,0.168%,0.00,United States,,2475,Finance,Investment Managers
RILYT,B. Riley Financial Inc. 6.00% Senior Notes Due 2028,$25.67,0.08,0.313%,0.00,United States,,16039,Miscellaneous,Business Services
RIOT,Riot Blockchain Inc.  Common Stock ,$36.4341,5.4041,17.416%,3495659960.00,United States,,20429570,Technology,Retail: Computer Software & Peripheral Equipment
RIVE,Riverview Financial Corporation Common Stock,$11.33,0.00,0.00%,105946388.00,United States,,27,Finance,Major Banks
RKDA,Arcadia Biosciences Inc. Common Stock,$2.91,-0.03,-1.02%,62088485.00,United States,2015,128498,Basic Industries,Agricultural Chemicals
RLAY,Relay Therapeutics Inc. Common Stock,$34.22,0.00,0.00%,3161324359.00,United States,2020,114675,Health Care,Major Pharmaceuticals
RLMD,Relmada Therapeutics Inc. Common Stock,$32.14,1.00,3.211%,539831057.00,United States,,32687,Health Care,Major Pharmaceuticals
RMBI,Richmond Mutual Bancorporation Inc. Common Stock,$14.39,-0.08,-0.553%,185397925.00,United States,2019,11491,,
RMBL,RumbleOn Inc. Class B Common Stock,$37.34,-0.16,-0.427%,126696935.00,United States,,23612,Capital Goods,Automotive Aftermarket
RMBS,Rambus Inc. Common Stock,$20.00,0.10,0.503%,2250105080.00,United States,1997,180168,Technology,Semiconductors
RMCF,Rocky Mountain Chocolate Factory Inc. Common Stock,$6.14,0.08,1.32%,37570629.00,United States,,25020,Consumer Non-Durables,Specialty Foods
RMGB,RMG Acquisition Corp. II Class A Ordinary Shares,$9.978,-0.002,-0.02%,430301250.00,United States,2021,112693,Finance,Business Services
RMGBU,RMG Acquisition Corp. II Unit,$10.56,0.0491,0.467%,0.00,United States,2020,7139,Finance,Business Services
RMGBW,RMG Acquisition Corp. II Warrant,$1.7001,0.066,4.039%,0.00,United States,2021,9615,Finance,Business Services
RMGC,RMG Acquisition Corp. III Class A Ordinary Shares,$9.80,0.00,0.00%,591675000.00,United States,2021,5,Finance,Business Services
RMGCU,RMG Acquisition Corp. III Unit,$10.04,-0.01,-0.10%,0.00,United States,2021,4075,Finance,Business Services
RMGCW,RMG Acquisition Corp. III Warrant,$1.15,0.05,4.545%,0.00,United States,2021,305,Finance,Business Services
RMNI,Rimini Street Inc. (DE) Common Stock,$6.76,-0.61,-8.277%,576398160.00,United States,2015,451838,Technology,EDP Services
RMR,The RMR Group Inc. Class A Common Stock,$41.765,0.165,0.397%,685496922.00,United States,,18673,Finance,Real Estate
RMRM,RMR Mortgage Trust Common Stock,$11.99,0.05,0.419%,122322088.00,United States,,3564,Consumer Services,Real Estate Investment Trusts
RMTI,Rockwell Medical Inc. (DE) Common Stock,$0.9415,-0.0483,-4.88%,88151450.00,United States,1998,971401,Health Care,Major Pharmaceuticals
RNA,Avidity Biosciences Inc. Common Stock,$25.76,0.11,0.429%,968969123.00,United States,2020,56256,Health Care,Major Pharmaceuticals
RNDB,Randolph Bancorp Inc. Common Stock,$20.99,-0.53,-2.463%,111370442.00,United States,2016,4927,Finance,Major Banks
RNLX,Renalytix AI plc American Depositary Shares,$32.20,-1.34,-3.995%,1159961305.00,United Kingdom,2020,43508,Health Care,Medical Specialities
RNST,Renasant Corporation Common Stock,$42.345,-0.215,-0.505%,2384623359.00,United States,,72368,Finance,Major Banks
RNWK,RealNetworks Inc. Common Stock,$2.5617,-0.1483,-5.472%,120162694.00,United States,1997,445631,Technology,EDP Services
ROAD,Construction Partners Inc. Class A Common Stock,$33.4097,0.4597,1.395%,1747076002.00,United States,2018,69004,Capital Goods,Engineering & Construction
ROCC,Roth CH Acquisition II Co. Common Stock,$10.00,0.00,0.00%,146500000.00,United States,2021,14349,,
ROCCU,Roth CH Acquisition II Co. Unit,$10.6815,-0.0285,-0.266%,0.00,United States,2020,3161,,
ROCCW,Roth CH Acquisition II Co. Warrant,$1.55,-0.0862,-5.268%,0.00,United States,2021,42052,Finance,Business Services
ROCK,Gibraltar Industries Inc. Common Stock,$75.75,-0.52,-0.682%,2471695685.00,United States,1993,48268,,
ROCR,Roth CH Acquisition III Co. Common stock,$9.73,0.0009,0.009%,143838590.00,United States,2021,1453,,
ROCRU,Roth CH Acquisition III Co. Unit,$9.91,-0.0736,-0.737%,0.00,United States,2021,1626,,
ROCRW,Roth CH Acquisition III Co. Warrant,$1.015,0.0425,4.37%,0.00,United States,2021,774,Finance,Business Services
ROIC,Retail Opportunity Investments Corp. Common Stock (MD),$18.525,-0.085,-0.457%,2200357133.00,United States,,229597,Consumer Services,Real Estate Investment Trusts
ROKU,Roku Inc. Class A Common Stock,$364.62,17.64,5.084%,48275171333.00,United States,2017,3213991,Consumer Services,Television Services
ROLL,RBC Bearings Incorporated Common Stock,$200.60,0.96,0.481%,5060346633.00,United States,2005,37085,Capital Goods,Metal Fabrications
ROOT,Root Inc. Class A Common Stock,$12.01,0.02,0.167%,3037665424.00,United States,2020,2962735,Finance,Property-Casualty Insurers
ROST,Ross Stores Inc. Common Stock,$118.455,-1.625,-1.353%,42302728609.00,United States,1985,992513,Consumer Services,Clothing/Shoe/Accessory Stores
RPAY,Repay Holdings Corporation Class A Common Stock,$24.08,0.07,0.292%,1937130770.00,United States,2018,122006,Technology,EDP Services
RPD,Rapid7 Inc. Common Stock,$89.81,0.93,1.046%,4951221887.00,United States,2015,152530,Technology,Computer Software: Prepackaged Software
RPHM,Reneo Pharmaceuticals Inc. Common Stock,$12.02,0.02,0.167%,291920761.00,United States,2021,53326,Health Care,Major Pharmaceuticals
RPRX,Royalty Pharma plc Class A Ordinary Shares ,$44.72,-0.18,-0.401%,27150071089.00,United States,2020,517770,Health Care,Major Pharmaceuticals
RPTX,Repare Therapeutics Inc. Common Shares,$33.085,-0.345,-1.032%,1224168391.00,Canada,2020,28711,,
RRBI,Red River Bancshares Inc. Common Stock,$53.20,0.00,0.00%,388639034.00,United States,2019,805,Finance,Major Banks
RRGB,Red Robin Gourmet Burgers Inc. Common Stock,$31.97,-0.54,-1.661%,501357025.00,United States,2002,67006,Consumer Services,Restaurants
RRR,Red Rock Resorts Inc. Class A Common Stock,$43.73,-0.97,-2.17%,5114403886.00,United States,2016,168074,Consumer Services,Recreational Products/Toys
RSSS,Research Solutions Inc Common Stock,$2.4562,0.0462,1.917%,64725802.00,United States,,19659,Technology,Retail: Computer Software & Peripheral Equipment
RSVA,Rodgers Silicon Valley Acquisition Corp. Common Stock,$19.36,-0.64,-3.20%,556600000.00,United States,2021,142397,,
RSVAU,Rodgers Silicon Valley Acquisition Corp. Unit,$23.90,-0.30,-1.24%,0.00,United States,2020,8448,,
RSVAW,Rodgers Silicon Valley Acquisition Corp. Warrant,$8.49,0.28,3.41%,0.00,United States,2021,6246,Finance,Business Services
RTLR,Rattler Midstream LP Common Units,$11.85,0.13,1.109%,1760527731.00,United States,2019,68453,Energy,Oilfield Services/Equipment
RTPY,Reinvent Technology Partners Y Class A Ordinary Shares,$10.02,0.05,0.502%,1224318750.00,United States,2021,220412,Finance,Business Services
RTPYU,Reinvent Technology Partners Y Unit,$10.25,0.05,0.49%,0.00,United States,2021,16023,Finance,Business Services
RTPYW,Reinvent Technology Partners Y Warrant,$1.7898,-0.0602,-3.254%,0.00,United States,2021,98261,Finance,Business Services
RUBY,Rubius Therapeutics Inc. Common Stock,$28.77,1.17,4.239%,2569644365.00,United States,2018,377677,Health Care,Biotechnology: Biological Products (No Diagnostic Substances)
RUN,Sunrun Inc. Common Stock,$45.29,0.33,0.734%,9235976838.00,United States,2015,2252805,Capital Goods,Building Products
RUSHA,Rush Enterprises Inc. Common Stock Cl A,$46.00,-0.60,-1.288%,2556515826.00,United States,,41738,Consumer Services,Other Specialty Stores
RUSHB,Rush Enterprises Inc. Class B,$40.92,-0.51,-1.231%,2274187557.00,United States,,2114,Consumer Services,Other Specialty Stores
RUTH,Ruth's Hospitality Group Inc. Common Stock,$24.24,-0.20,-0.818%,833060443.00,United States,2005,139565,Consumer Services,Restaurants
RVMD,Revolution Medicines Inc. Common Stock,$34.58,0.31,0.905%,2539644901.00,United States,2020,131271,Consumer Durables,Specialty Chemicals
