Symbol,Name,Last Sale,Net Change,% Change,Market Cap,Country,IPO Year,Volume,Sector,Industry
IMKTA,Ingles Markets Incorporated Class A Common Stock,$62.1159,-0.7541,-1.199%,1179852760.00,United States,1987,53244,Consumer Services,Food Chains
IMMP,Immutep Limited American Depositary Shares,$4.845,-0.065,-1.324%,314307398.00,Australia,,128048,Health Care,Major Pharmaceuticals
IMMR,Immersion Corporation Common Stock,$9.1631,0.3531,4.008%,283007301.00,United States,1999,316663,Technology,Computer peripheral equipment
IMNM,Immunome Inc. Common Stock,$17.354,-0.406,-2.286%,204035403.00,United States,2020,52085,Consumer Durables,Specialty Chemicals
IMOS,ChipMOS TECHNOLOGIES INC. American Depositary Shares,$34.685,0.255,0.741%,1261216178.00,Taiwan,,8612,Technology,Semiconductors
IMPL,Impel NeuroPharma Inc. Common Stock,$10.545,0.225,2.18%,234903278.00,United States,2021,20175,Health Care,Major Pharmaceuticals
IMRA,IMARA Inc. Common Stock,$8.769,0.219,2.561%,154689474.00,United States,2020,77227,Health Care,Biotechnology: Biological Products (No Diagnostic Substances)
IMTE,Integrated Media Technology Limited Ordinary Shares,$4.8285,0.1785,3.839%,40755114.00,Australia,,224205,Consumer Non-Durables,Consumer Electronics/Appliances
IMTX,Immatics N.V. Ordinary Shares,$12.33,0.07,0.571%,775663248.00,Germany,,34613,Health Care,Biotechnology: Biological Products (No Diagnostic Substances)
IMTXW,Immatics N.V. Warrants,$3.6452,-0.0548,-1.481%,0.00,Germany,,1661,Health Care,Biotechnology: Biological Products (No Diagnostic Substances)
IMUX,Immunic Inc. Common Stock,$14.535,0.335,2.359%,316128096.00,United States,2014,43571,Health Care,Major Pharmaceuticals
IMV,IMV Inc. Common Shares,$2.3839,-0.0061,-0.255%,161618725.00,Canada,,22652,,
IMVT,Immunovant Inc. Common Stock,$10.76,0.05,0.467%,880294183.00,United States,2019,341796,Health Care,Major Pharmaceuticals
IMXI,International Money Express Inc. Common Stock,$15.18,0.00,0.00%,594192076.00,United States,2017,24523,Technology,EDP Services
INBK,First Internet Bancorp Common Stock,$32.7765,-0.4735,-1.424%,322979697.00,United States,,14948,Finance,Major Banks
INBKL,First Internet Bancorp 6.0% Fixed-to-Floating Rate Subordinated Notes due 2026,$25.99,-0.217,-0.828%,0.00,United States,,191,,
INBKZ,First Internet Bancorp 6.0% Fixed-to-Floating Rate Subordinated Notes Due 2029,$26.03,0.00,0.00%,0.00,United States,,424,Finance,Major Banks
INBX,Inhibrx Inc. Common Stock,$24.94,0.54,2.213%,943000130.00,United States,2020,219688,Health Care,Major Pharmaceuticals
INCY,Incyte Corp. Common Stock,$81.98,-0.60,-0.727%,18029326644.00,United States,,730067,Health Care,Biotechnology: Commercial Physical & Biological Resarch
INDB,Independent Bank Corp. Common Stock,$78.84,-0.67,-0.843%,2604160413.00,United States,,66312,Finance,Major Banks
INDI,indie Semiconductor Inc. Class A Common Stock,$10.06,-0.70,-6.506%,0.00,United States,,743939,,
INDIW,indie Semiconductor Inc. Warrant,$2.15,-0.40,-15.686%,0.00,United States,,168666,,
INDT,INDUS Realty Trust Inc. (MD) Common Stock,$66.915,-0.285,-0.424%,516384259.00,United States,,10435,Finance,Real Estate
INFI,Infinity Pharmaceuticals Inc. Common Stock,$3.40,-0.05,-1.449%,301400619.00,United States,,1027012,Health Care,Major Pharmaceuticals
INFN,Infinera Corporation Common Stock,$10.415,-0.135,-1.28%,2135039485.00,United States,2007,450244,Public Utilities,Telecommunications Equipment
INGN,Inogen Inc Common Stock,$63.57,-0.90,-1.396%,1423673035.00,United States,2014,23805,Health Care,Industrial Specialties
INKA,KludeIn I Acquisition Corp. Class A Common Stock,$9.78,0.02,0.205%,210881250.00,United States,2021,2061,,
INKAU,KludeIn I Acquisition Corp. Unit,$10.08,-0.04,-0.395%,0.00,United States,2021,210,,
INKAW,KludeIn I Acquisition Corp. Warrant,$0.6601,-0.085,-11.408%,0.00,United States,2021,100,Finance,Business Services
INM,InMed Pharmaceuticals Inc. Common Shares,$2.8851,0.0451,1.588%,23227095.00,Canada,,75754,,
INMB,INmune Bio Inc. Common stock,$19.05,1.16,6.484%,284466754.00,United States,2019,225685,Health Care,Major Pharmaceuticals
INMD,InMode Ltd. Ordinary Shares,$92.11,0.05,0.054%,3517759286.00,Israel,2019,413792,Health Care,Medical/Nursing Services
INNV,InnovAge Holding Corp. Common Stock,$21.45,0.20,0.941%,2906829204.00,United States,2021,135969,Health Care,Hospital/Nursing Management
INO,Inovio Pharmaceuticals Inc. Common Stock,$9.0531,-0.0469,-0.515%,1895712441.00,United States,,3482073,Health Care,Biotechnology: Biological Products (No Diagnostic Substances)
INOD,Innodata Inc. Common Stock,$7.35,0.11,1.519%,193428576.00,United States,1993,64786,Technology,EDP Services
INOV,Inovalon Holdings Inc. Class A Common Stock,$32.735,-0.065,-0.198%,5103165342.00,United States,2015,122264,Technology,EDP Services
INPX,Inpixon Common Stock,$1.25,0.06,5.042%,139725781.00,United States,2014,2225927,Technology,Computer Software: Prepackaged Software
INSE,Inspired Entertainment Inc. Common Stock,$11.50,-0.35,-2.954%,267010715.00,United States,2014,117925,,
INSG,Inseego Corp. Common Stock,$10.565,0.095,0.907%,1086351820.00,United States,,585793,Capital Goods,Telecommunications Equipment
INSM,Insmed Inc. Common Stock,$29.56,-0.50,-1.663%,3399163727.00,United States,,957339,Health Care,Major Pharmaceuticals
INTC,Intel Corporation Common Stock,$57.695,-0.155,-0.268%,232972410000.00,United States,,7570977,Technology,Semiconductors
INTG,Intergroup Corporation (The) Common Stock,$33.73,0.02,0.059%,75444363.00,United States,,766,Consumer Services,Hotels/Resorts
INTU,Intuit Inc. Common Stock,$472.53,0.37,0.078%,129123200963.00,United States,1993,449382,Technology,Computer Software: Prepackaged Software
INTZ,Intrusion Inc. Common Stock,$16.84,-0.23,-1.347%,296720901.00,United States,,76667,Miscellaneous,Diversified Manufacture
INVA,Innoviva Inc. Common Stock,$12.70,0.10,0.794%,881414950.00,United States,,309339,Health Care,Major Pharmaceuticals
INVE,Identiv Inc. Common Stock,$16.875,1.175,7.484%,370969774.00,United States,,159755,Technology,Computer peripheral equipment
INVO,INVO BioScience Inc. Common Stock,$5.1201,-0.0599,-1.156%,53500104.00,United States,,179005,Health Care,Medical/Dental Instruments
INVZ,Innoviz Technologies Ltd. Ordinary shares,$9.96,0.10,1.014%,1293016791.00,Israel,,672534,Capital Goods,Auto Parts:O.E.M.
INVZW,Innoviz Technologies Ltd. Warrant,$2.54,-0.13,-4.869%,0.00,Israel,,3995,Capital Goods,Auto Parts:O.E.M.
INZY,Inozyme Pharma Inc. Common Stock,$16.77,0.11,0.66%,393811470.00,United States,2020,25940,Health Care,Major Pharmaceuticals
IONS,Ionis Pharmaceuticals Inc. Common Stock,$37.66,-0.27,-0.712%,5308667634.00,United States,,340828,Health Care,Major Pharmaceuticals
IOSP,Innospec Inc. Common Stock,$98.27,-0.24,-0.244%,2418252236.00,United States,,36005,Basic Industries,Industrial Specialties
IOVA,Iovance Biotherapeutics Inc. Common Stock,$24.125,0.675,2.878%,3687488928.00,United States,,1551846,Health Care,Major Pharmaceuticals
IPA,ImmunoPrecise Antibodies Ltd. Common Stock,$7.47,0.33,4.622%,142520130.00,Canada,,42169,,
IPAR,Inter Parfums Inc. Common Stock,$76.19,-0.43,-0.561%,2411568775.00,United States,,11086,Consumer Non-Durables,Package Goods/Cosmetics
IPDN,Professional Diversity Network Inc. Common Stock,$1.9844,0.0344,1.764%,26719990.00,United States,2013,614491,Technology,EDP Services
IPGP,IPG Photonics Corporation Common Stock,$207.00,3.40,1.67%,11090772270.00,United States,2006,69415,Technology,Semiconductors
IPHA,Innate Pharma S.A. ADS,$4.023,-0.117,-2.826%,317732376.00,France,2019,49163,Health Care,Major Pharmaceuticals
IPLDP,Interstate Power & Light Company Perp Prd Ser D,$26.2154,0.0354,0.135%,0.00,United States,,1811,Public Utilities,Power Generation
IPVI,InterPrivate IV InfraTech Partners Inc. Class A Common Stock,$9.73,0.00,0.00%,0.00,United States,2021,100,,
IPVIU,InterPrivate IV InfraTech Partners Inc. Units,$9.95,-0.02,-0.201%,0.00,United States,2021,8600,,
IPW,iPower Inc. Common Stock,$8.345,0.095,1.152%,212534599.00,United States,2021,38191,Consumer Services,Catalog/Specialty Distribution
IPWR,Ideal Power Inc. Common Stock,$12.9901,0.7901,6.476%,76278465.00,United States,2013,83620,Capital Goods,Industrial Machinery/Components
IQ,iQIYI Inc. American Depositary Shares,$15.695,1.155,7.944%,12387826631.00,China,2018,9163590,Technology,Internet and Information Services
IRBT,iRobot Corporation Common Stock,$97.235,1.405,1.466%,2731816742.00,United States,2005,175446,,
IRCP,IRSA Propiedades Comerciales S.A. American Depositary Shares,$11.30,-0.12,-1.051%,355989686.00,Argentina,,18256,Consumer Services,Building operators
IRDM,Iridium Communications Inc Common Stock,$39.575,0.515,1.318%,5282424974.00,United States,,207729,Consumer Services,Telecommunications Equipment
IRIX,IRIDEX Corporation Common Stock,$7.74,0.00,0.00%,120943692.00,United States,1996,30296,Health Care,Biotechnology: Electromedical & Electrotherapeutic Apparatus
IRMD,iRadimed Corporation Common Stock,$29.14,0.35,1.216%,358785696.00,United States,2014,1956,Health Care,Medical/Dental Instruments
IROQ,IF Bancorp Inc. Common Stock,$22.56,0.00,0.00%,73102883.00,United States,2011,398,Finance,Finance: Consumer Services
IRTC,iRhythm Technologies Inc. Common Stock,$64.29,0.39,0.61%,1883893085.00,United States,2016,190501,Health Care,Medical/Dental Instruments
IRWD,Ironwood Pharmaceuticals Inc. Class A Common Stock,$11.365,-0.365,-3.112%,1840751966.00,United States,2010,514904,Health Care,Major Pharmaceuticals
ISAA,Iron Spark I Inc. Class A Common Stock,$9.9501,-0.0499,-0.499%,197409984.00,United States,2021,113067,,
ISBC,Investors Bancorp Inc. Common Stock,$14.56,-0.12,-0.817%,3606076743.00,United States,,593212,Finance,Savings Institutions
ISEE,IVERIC bio Inc. Common Stock,$6.16,-0.13,-2.067%,555971515.00,United States,2013,264567,Health Care,Major Pharmaceuticals
ISIG,Insignia Systems Inc. Common Stock,$8.01,0.11,1.392%,14049780.00,United States,1991,3185,Technology,Advertising
ISLE,Isleworth Healthcare Acquisition Corporation Common stock,$9.74,-0.01,-0.103%,255102775.00,United States,2021,44223,,
ISLEW,Isleworth Healthcare Acquisition Corporation Warrant,$0.6699,0.0199,3.062%,0.00,United States,2021,3535,Consumer Services,Hotels/Resorts
ISNS,Image Sensing Systems Inc. Common Stock,$7.20,-0.11,-1.505%,38551226.00,United States,1995,116815,Capital Goods,Industrial Machinery/Components
ISRG,Intuitive Surgical Inc. Common Stock,$867.36,3.09,0.358%,102706602536.00,United States,2000,173718,Health Care,Medical/Dental Instruments
ISSC,Innovative Solutions and Support Inc. Common Stock,$6.10,-0.05,-0.813%,105175419.00,United States,2000,1645,Capital Goods,Military/Government/Technical
ISTR,Investar Holding Corporation Common Stock,$22.72,-0.14,-0.612%,236590880.00,United States,2014,12502,Finance,Commercial Banks
ISUN,iSun Inc. Common Stock,$10.45,0.08,0.771%,94967165.00,United States,2016,97277,Technology,Semiconductors
ITAC,Industrial Tech Acquisitions Inc. Class A common stock,$10.08,-0.02,-0.198%,97581819.00,United States,2020,17787,,
ITACU,Industrial Tech Acquisitions Inc. Unit,$11.15,0.05,0.45%,0.00,United States,2020,2185,,
ITACW,Industrial Tech Acquisitions Inc. Warrant,$1.0699,0.0299,2.875%,0.00,United States,2020,51684,,
ITCI,Intra-Cellular Therapies Inc. Common Stock,$42.315,0.635,1.524%,3436072193.00,United States,,122746,Health Care,Major Pharmaceuticals
ITHX,ITHAX Acquisition Corp. Class A Ordinary Shares,$9.69,-0.01,-0.103%,299057625.00,United States,2021,7400,Finance,Business Services
ITHXU,ITHAX Acquisition Corp. Unit,$9.98,0.05,0.504%,0.00,United States,2021,7400,Finance,Business Services
ITHXW,ITHAX Acquisition Corp. Warrant,$0.67,0.0701,11.685%,0.00,United States,2021,5600,Finance,Business Services
ITI,Iteris Inc. Common Stock,$6.98,0.53,8.217%,292097909.00,United States,,107314,Capital Goods,Telecommunications Equipment
ITIC,Investors Title Company Common Stock,$174.30,0.44,0.253%,330145465.00,United States,,554,Finance,Specialty Insurers
ITMR,Itamar Medical Ltd. American Depository Shares,$20.41,0.31,1.542%,334461058.00,Israel,,17682,Health Care,Medical/Dental Instruments
ITOS,iTeos Therapeutics Inc. Common Stock,$27.42,7.39,36.895%,962551653.00,United States,2020,3567236,Consumer Durables,Specialty Chemicals
ITQ,Itiquira Acquisition Corp. Class A Ordinary Shares,$9.67,-0.04,-0.412%,278012500.00,United States,2021,150020,Finance,Business Services
ITQRU,Itiquira Acquisition Corp. Unit,$10.00,0.01,0.10%,0.00,United States,2021,415651,Finance,Business Services
ITQRW,Itiquira Acquisition Corp. Warrant,$0.7001,0.05,7.691%,0.00,United States,2021,2000,Finance,Business Services
ITRI,Itron Inc. Common Stock,$99.42,0.71,0.719%,4487084285.00,United States,1993,138344,Capital Goods,Electrical Products
ITRM,Iterum Therapeutics plc Ordinary Share,$2.06,0.18,9.574%,369025864.00,Ireland,2018,15851837,Health Care,Major Pharmaceuticals
ITRN,Ituran Location and Control Ltd. Ordinary Shares,$26.49,1.71,6.901%,551344476.00,Israel,2005,71701,Technology,Electronic Components
IVA,Inventiva S.A. American Depository Shares,$15.435,-0.235,-1.50%,596258079.00,France,2020,20571,Consumer Services,Other Consumer Services
IVAC,Intevac Inc. Common Stock,$6.78,0.52,8.307%,163548618.00,United States,1995,142064,,
IZEA,IZEA Worldwide Inc. Common Stock,$2.885,0.115,4.152%,178081238.00,United States,,934970,Technology,Advertising
JACK,Jack In The Box Inc. Common Stock,$118.61,-0.52,-0.436%,2636480397.00,United States,,89085,Consumer Services,Restaurants
JAGX,Jaguar Health Inc. Common Stock,$1.865,-0.045,-2.356%,256102326.00,United States,2015,7382429,Health Care,Major Pharmaceuticals
JAKK,JAKKS Pacific Inc. Common Stock,$13.74,1.07,8.445%,87878471.00,United States,1996,204284,Consumer Non-Durables,Recreational Products/Toys
JAMF,Jamf Holding Corp. Common Stock,$32.05,0.24,0.754%,3773090481.00,United States,2020,400837,Technology,Computer Software: Prepackaged Software
JAN,JanOne Inc. Common Stock (NV),$9.20,0.27,3.024%,25975372.00,United States,,460659,Public Utilities,Environmental Services
JANX,Janux Therapeutics Inc. Common Stock,$21.7193,-3.4307,-13.641%,825366196.00,United States,2021,626448,,
JAZZ,Jazz Pharmaceuticals plc Common Stock (Ireland),$185.77,-0.40,-0.215%,11275133483.00,Ireland,2007,469087,Health Care,Major Pharmaceuticals
JBHT,J.B. Hunt Transport Services Inc. Common Stock,$164.68,-0.57,-0.345%,17401901268.00,United States,,185012,Transportation,Trucking Freight/Courier Services
JBLU,JetBlue Airways Corporation Common Stock,$18.40,-0.25,-1.34%,5826118702.00,United States,2002,2795364,Transportation,Air Freight/Delivery Services
JBSS,John B. Sanfilippo & Son Inc. Common Stock,$92.20,0.80,0.875%,1057380764.00,United States,1991,11266,Consumer Non-Durables,Specialty Foods
JCIC,Jack Creek Investment Corp. Class A Ordinary Shares,$9.737,0.022,0.226%,419908125.00,United States,2021,9567,Finance,Business Services
JCICU,Jack Creek Investment Corp. Units,$10.10,0.12,1.202%,0.00,United States,2021,8594,Finance,Business Services
JCICW,Jack Creek Investment Corp. Warrants,$0.7697,0.0397,5.438%,0.00,United States,2021,2363,Finance,Business Services
JCOM,j2 Global Inc. Common Stock,$128.46,-0.62,-0.48%,5795112955.00,United States,1999,132584,Technology,Telecommunications Equipment
JCS,Communications Systems Inc. Common Stock,$7.21,0.12,1.693%,67200625.00,United States,,28088,Public Utilities,Telecommunications Equipment
JCTCF,Jewett-Cameron Trading Company Common Shares,$9.62,-0.1886,-1.923%,33565729.00,United States,,263,,
JD,JD.com Inc. American Depositary Shares,$71.50,0.31,0.435%,111467446019.00,China,2014,5235354,Miscellaneous,Business Services
JFIN,Jiayin Group Inc. American Depositary Shares,$6.16,0.00,0.00%,332794000.00,China,2019,98286,Finance,Finance: Consumer Services
JFU,9F Inc. American Depositary Shares,$2.46,0.08,3.361%,500636275.00,China,2019,1469676,Finance,Finance: Consumer Services
JG,Aurora Mobile Limited American Depositary Shares,$3.085,-0.075,-2.373%,363762765.00,China,2018,434180,Technology,EDP Services
JJSF,J & J Snack Foods Corp. Common Stock,$175.37,-0.74,-0.42%,3338337708.00,United States,1986,12200,Consumer Non-Durables,Specialty Foods
JKHY,Jack Henry & Associates Inc. Common Stock,$162.085,-0.485,-0.298%,12024368924.00,United States,1985,174835,Technology,Retail: Computer Software & Peripheral Equipment
JMPNL,JMP Group LLC 7.25% Senior Notes due 2027,$25.40,0.001,0.004%,0.00,United States,,1177,Finance,Investment Bankers/Brokers/Service
JMPNZ,JMP Group LLC 6.875% Senior Notes due 2029,$25.13,0.1291,0.516%,0.00,United States,,1670,Finance,Investment Bankers/Brokers/Service
JNCE,Jounce Therapeutics Inc. Common Stock,$7.06,-0.01,-0.141%,361531000.00,United States,2017,359232,Health Care,Major Pharmaceuticals
JOAN,JOANN Inc. Common Stock,$15.64,-0.54,-3.337%,659380820.00,United States,2021,204144,Consumer Non-Durables,Department/Specialty Retail Stores
JOBS,51job Inc. American Depositary Shares,$74.04,-0.02,-0.027%,4992734433.00,China,2004,50816,Technology,Diversified Commercial Services
JOFF,JOFF Fintech Acquisition Corp. Class A Common Stock,$9.71,0.001,0.01%,0.00,United States,2021,38212,,
JOFFU,JOFF Fintech Acquisition Corp. Unit,$9.97,-0.03,-0.30%,0.00,United States,2021,19578,,
JOFFW,JOFF Fintech Acquisition Corp. Warrant,$0.9199,0.0199,2.211%,0.00,United States,2021,12624,Finance,Business Services
JOUT,Johnson Outdoors Inc. Class A Common Stock,$121.335,-2.765,-2.228%,1227690341.00,United States,,12908,Consumer Non-Durables,Recreational Products/Toys
JRJC,China Finance Online Co. Limited American Depositary Shares,$10.4601,-0.3799,-3.505%,25543146.00,China,2004,32672,Finance,Investment Bankers/Brokers/Service
JRSH,Jerash Holdings (US) Inc. Common Stock,$6.35,0.00,0.00%,71913750.00,United States,2018,9495,Basic Industries,Industrial Specialties
JRVR,James River Group Holdings Ltd. Common Shares,$35.81,0.01,0.028%,1334725718.00,Bermuda,2014,66340,Finance,Property-Casualty Insurers
JSM,Navient Corporation 6% Senior Notes due December 15 2043,$25.00,-0.02,-0.08%,0.00,United States,,1357,Finance,Finance: Consumer Services
JUPW,Jupiter Wellness Inc. Common Stock,$4.425,0.035,0.797%,50490082.00,United States,2020,58714,Health Care,Major Pharmaceuticals
JUPWW,Jupiter Wellness Inc. Warrant,$1.28,-0.023,-1.765%,0.00,United States,2020,7208,Health Care,Major Pharmaceuticals
JVA,Coffee Holding Co. Inc. Common Stock,$6.08,-0.11,-1.777%,34708282.00,United States,2005,76926,Consumer Non-Durables,Specialty Foods
JWEL,Jowell Global Ltd. Ordinary Shares,$6.2631,-0.0269,-0.428%,159213351.00,China,2021,34088,Consumer Services,Other Consumer Services
JYAC,Jiya Acquisition Corp. Class A Common Stock,$9.83,0.00,0.00%,132184905.00,United States,2020,109,,
JYNT,The Joint Corp. Common Stock,$75.29,-1.35,-1.761%,1071128243.00,United States,2014,106837,,
JZXN,Jiuzi Holdings Inc. Ordinary Shares,$8.41,-0.13,-1.522%,169882000.00,China,2021,299542,Consumer Durables,Automotive Aftermarket
KAII,Kismet Acquisition Two Corp. Class A Ordinary Shares,$9.70,0.02,0.207%,283725000.00,United States,2021,1360,Finance,Business Services
KAIIU,Kismet Acquisition Two Corp. Unit,$9.9722,0.0122,0.122%,0.00,United States,2021,1843,Finance,Business Services
KAIIW,Kismet Acquisition Two Corp. Warrant,$0.8797,0.0903,11.439%,0.00,United States,2021,16891,Finance,Business Services
KAIR,Kairos Acquisition Corp. Class A Ordinary Shares,$9.76,0.00,0.00%,336720000.00,United States,2021,1,Finance,Business Services
KAIRW,Kairos Acquisition Corp. Warrant,$0.7699,0.0199,2.653%,0.00,United States,2021,300,Finance,Business Services
KALA,Kala Pharmaceuticals Inc. Common Stock,$6.26,-0.07,-1.106%,350934755.00,United States,2017,851590,Health Care,Major Pharmaceuticals
KALU,Kaiser Aluminum Corporation Common Stock,$128.81,-5.29,-3.945%,2041372894.00,United States,,34231,Basic Industries,Aluminum
KALV,KalVista Pharmaceuticals Inc. Common Stock,$28.41,-0.33,-1.148%,693850867.00,United Kingdom,2015,57281,Health Care,Major Pharmaceuticals
KARO,Karooooo Ltd. Ordinary Shares,$38.21,0.21,0.553%,823058455.00,Singapore,2021,4572,Technology,Computer Software: Prepackaged Software
KBAL,Kimball International Inc. Class B Common Stock,$13.99,-0.01,-0.071%,514618820.00,United States,,78392,Consumer Durables,Industrial Specialties
KBNT,Kubient Inc. Common Stock,$5.35,-0.12,-2.194%,74806220.00,United States,2020,107564,Technology,EDP Services
KBNTW,Kubient Inc. Warrant,$2.00,0.05,2.564%,0.00,United States,2020,4100,Technology,EDP Services
KBSF,KBS Fashion Group Limited Common Stock,$4.3994,0.3894,9.711%,11400161.00,China,2013,274395,Consumer Non-Durables,Apparel
KC,Kingsoft Cloud Holdings Limited American Depositary Shares,$35.715,1.715,5.044%,7976026910.00,China,2020,1920937,Technology,Computer Software: Prepackaged Software
KDMN,Kadmon Holdings Inc. Common Stock,$4.115,0.005,0.122%,707672450.00,United States,,756289,Health Care,Major Pharmaceuticals
KDNY,Chinook Therapeutics Inc. Common Stock,$16.98,0.23,1.373%,757584706.00,United States,2015,107276,Health Care,Major Pharmaceuticals
KDP,Keurig Dr Pepper Inc. Common Stock,$34.58,-0.65,-1.845%,49014480943.00,United States,,2175807,Consumer Non-Durables,Beverages (Production/Distribution)
KE,Kimball Electronics Inc. Common Stock,$22.35,0.48,2.195%,557790313.00,United States,,41153,Capital Goods,Industrial Machinery/Components
KELYA,Kelly Services Inc. Class A Common Stock,$25.14,-0.03,-0.119%,989737816.00,United States,,21758,Technology,Diversified Commercial Services
KELYB,Kelly Services Inc. Class B Common Stock,$25.2432,0.00,0.00%,993800702.00,United States,,442,Technology,Diversified Commercial Services
KEQU,Kewaunee Scientific Corporation Common Stock,$11.63,-0.12,-1.021%,32131329.00,United States,,461,Capital Goods,Medical Specialities
KERN,Akerna Corp. Common Stock,$4.4807,-0.0393,-0.869%,62992848.00,United States,2018,319534,Health Care,Managed Health Care
KERNW,Akerna Corp Warrant,$1.1399,0.1099,10.67%,0.00,United States,2018,3518,Health Care,Managed Health Care
KFFB,Kentucky First Federal Bancorp Common Stock,$7.11,0.00,0.00%,58491944.00,United States,,468,Finance,Savings Institutions
KFRC,Kforce Inc. Common Stock,$62.82,0.16,0.255%,1376696280.00,United States,1995,14761,Technology,Diversified Commercial Services
KHC,The Kraft Heinz Company Common Stock,$42.275,-1.145,-2.637%,51708553799.00,United States,,3067486,Consumer Non-Durables,Farming/Seeds/Milling
KIDS,OrthoPediatrics Corp. Common Stock,$64.25,0.74,1.165%,1263091842.00,United States,2017,28735,Health Care,Medical/Dental Instruments
KIII,Kismet Acquisition Three Corp. Class A Ordinary Shares,$9.69,0.01,0.103%,353079375.00,United States,2021,10535,Finance,Business Services
KIIIU,Kismet Acquisition Three Corp. Unit,$9.96,0.00,0.00%,0.00,United States,2021,823,Finance,Business Services
KIIIW,Kismet Acquisition Three Corp. Warrant,$0.80,-0.045,-5.325%,0.00,United States,2021,500,Finance,Business Services
KIN,Kindred Biosciences Inc. Common Stock,$6.185,-0.175,-2.752%,280016622.00,United States,2013,268190,Health Care,Major Pharmaceuticals
KINS,Kingstone Companies Inc. Common Stock,$8.33,0.07,0.847%,88969839.00,United States,,1795,Finance,Specialty Insurers
KINZ,KINS Technology Group Inc. Class A Common Stock,$9.88,-0.01,-0.101%,340860000.00,United States,2021,102664,,
KINZU,KINS Technology Group Inc. Unit,$10.26,0.00,0.00%,0.00,United States,2020,1,,
KINZW,KINS Technology Group Inc. Warrant,$0.74,-0.0599,-7.488%,0.00,United States,2021,4240,Finance,Business Services
KIRK,Kirkland's Inc. COMMONSTOCK,$23.29,-0.48,-2.019%,331942565.00,United States,2002,218743,Miscellaneous,Diversified Commercial Services
KLAC,KLA Corporation Common Stock,$323.596,3.486,1.089%,49601371852.00,United States,1980,263015,Capital Goods,Electronic Components
KLAQ,KL Acquisition Corp Class A Common Stock,$9.70,-0.03,-0.308%,348593750.00,United States,2021,13549,,
KLAQU,KL Acquisition Corp Unit,$9.9503,0.0003,0.003%,0.00,United States,2021,446,,
KLAQW,KL Acquisition Corp Warrant,$0.76,-0.001,-0.131%,0.00,United States,2021,79999,Finance,Business Services
KLDO,Kaleido Biosciences Inc. Common Stock,$6.84,0.09,1.333%,290827587.00,United States,2019,100377,Health Care,Biotechnology: Biological Products (No Diagnostic Substances)
KLIC,Kulicke and Soffa Industries Inc. Common Stock,$56.95,0.16,0.282%,3533948761.00,Singapore,,424784,Technology,Semiconductors
KLXE,KLX Energy Services Holdings Inc. Common Stock,$9.42,-0.07,-0.738%,83170471.00,United States,,150550,Energy,Oilfield Services/Equipment
KMDA,Kamada Ltd. Ordinary Shares,$5.86,-0.04,-0.678%,262207833.00,Israel,2013,34385,Health Care,Major Pharmaceuticals
KMPH,KemPharm Inc. Common Stock,$14.46,-0.16,-1.094%,412215515.00,United States,,1155346,Health Care,Major Pharmaceuticals
KNBE,KnowBe4 Inc. Class A Common Stock,$21.68,1.88,9.495%,3678496223.00,United States,2021,222042,Technology,Computer Software: Prepackaged Software
KNDI,Kandi Technologies Group Inc Common Stock,$6.35,-0.01,-0.157%,478710974.00,China,,545365,Capital Goods,Auto Parts:O.E.M.
KNSA,Kiniksa Pharmaceuticals Ltd. Class A Common Stock,$15.225,0.365,2.456%,1040355218.00,United States,2018,129281,Health Care,Major Pharmaceuticals
KNSL,Kinsale Capital Group Inc. Common Stock,$162.305,-1.155,-0.707%,3702536718.00,United States,2016,28141,Finance,Property-Casualty Insurers
KNTE,Kinnate Biopharma Inc. Common Stock,$24.96,0.50,2.044%,1085871921.00,United States,2020,19465,Health Care,Major Pharmaceuticals
KOD,Kodiak Sciences Inc Common Stock,$85.10,1.48,1.77%,4362650734.00,United States,2018,301092,Health Care,Major Pharmaceuticals
KOPN,Kopin Corporation Common Stock,$9.3242,0.8842,10.476%,851158413.00,United States,1992,2684779,Capital Goods,Industrial Machinery/Components
KOR,Corvus Gold Inc. Common Shares,$3.0001,-0.0299,-0.987%,380448591.00,Canada,,51217,Basic Industries,Precious Metals
KOSS,Koss Corporation Common Stock,$24.85,-0.44,-1.74%,211643052.00,United States,,1105304,Consumer Non-Durables,Consumer Electronics/Appliances
KPLT,Katapult Holdings Inc. Common Stock,$12.88,-0.88,-6.395%,0.00,United States,2019,353326,,
