Symbol,Name,Last Sale,Net Change,% Change,Market Cap,Country,IPO Year,Volume,Sector,Industry
CSPI,CSP Inc. Common Stock,$11.495,0.175,1.546%,50508639.00,United States,1982,12740,Technology,EDP Services
CSQ,Calamos Strategic Total Return Common Stock,$17.9999,0.0099,0.055%,2793553070.00,United States,2004,101976,Finance,Finance Companies
CSSE,Chicken Soup for the Soul Entertainment Inc. Class A Common Stock,$37.90,0.39,1.04%,479393234.00,United States,2017,61401,Consumer Services,Broadcasting
CSSEN,Chicken Soup for the Soul Entertainment Inc. 9.50% Notes due 2025,$26.165,0.4087,1.587%,0.00,United States,,410,Consumer Services,Movies/Entertainment
CSSEP,Chicken Soup for the Soul Entertainment Inc. 9.75% Series A Cumulative Redeemable Perpetual Preferred Stock,$27.70,-0.0684,-0.246%,0.00,United States,,3794,Consumer Services,Broadcasting
CSTE,Caesarstone Ltd. Ordinary Shares,$15.56,-0.34,-2.138%,535906955.00,Israel,2012,51696,Capital Goods,Multi-Sector Companies
CSTL,Castle Biosciences Inc. Common Stock,$72.91,1.02,1.419%,1826862926.00,United States,2019,96097,Health Care,Medical Specialities
CSTR,CapStar Financial Holdings Inc. Common Stock,$21.25,-0.44,-2.029%,469511058.00,United States,2016,32312,Finance,Major Banks
CSWC,Capital Southwest Corporation Common Stock,$26.495,-0.625,-2.305%,557020918.00,United States,,181638,Finance,Finance Companies
CSWI,CSW Industrials Inc. Common Stock,$114.4117,-1.1483,-0.994%,1794832285.00,United States,,9958,Basic Industries,Home Furnishings
CSX,CSX Corporation Common Stock,$96.69,-0.54,-0.555%,73233026885.00,United States,,1118455,Transportation,Railroads
CTAQ,Carney Technology Acquisition Corp. II Class A Common Stock,$9.75,-0.03,-0.307%,499321875.00,United States,2021,954,,
CTAQU,Carney Technology Acquisition Corp. II Units,$10.01,0.00,0.00%,0.00,United States,2020,55,,
CTAQW,Carney Technology Acquisition Corp. II Warrant,$0.928,0.00,0.00%,0.00,United States,2021,100,Finance,Business Services
CTAS,Cintas Corporation Common Stock,$350.53,-2.31,-0.655%,36824297144.00,United States,1983,114308,Miscellaneous,Business Services
CTBI,Community Trust Bancorp Inc. Common Stock,$42.36,-0.495,-1.155%,755341450.00,United States,,12254,Finance,Major Banks
CTG,Computer Task Group Inc. Common Stock,$9.52,0.00,0.00%,146399217.00,United States,,9671,Technology,EDP Services
CTHR,Charles & Colvard Ltd Common Stock,$2.79,-0.02,-0.712%,83289731.00,United States,1997,96307,Consumer Services,Consumer Specialties
CTIB,Yunhong CTI Ltd. Common Stock,$1.945,-0.015,-0.765%,8742013.00,United States,1997,46650,Miscellaneous,Diversified Commercial Services
CTIC,CTI BioPharma Corp. (DE) Common Stock,$2.48,-0.04,-1.587%,231339886.00,United States,1997,180281,Health Care,Major Pharmaceuticals
CTLP,Cantaloupe Inc. Common Stock,$12.57,0.14,1.126%,893869204.00,United States,,115596,Technology,EDP Services
CTMX,CytomX Therapeutics Inc. Common Stock,$7.23,0.07,0.978%,470030470.00,United States,2015,167019,Health Care,Major Pharmaceuticals
CTRE,CareTrust REIT Inc. Common Stock,$23.825,0.075,0.316%,2305904912.00,United States,,202655,Consumer Services,Real Estate Investment Trusts
CTRM,Castor Maritime Inc. Common Shares,$3.335,-0.115,-3.333%,30000276.00,Cyprus,,3014870,Transportation,Marine Transportation
CTRN,Citi Trends Inc. Common Stock,$84.58,-0.22,-0.259%,782694947.00,United States,2005,216099,,
CTSH,Cognizant Technology Solutions Corporation Class A Common Stock,$70.49,-0.76,-1.067%,37177263703.00,United States,1998,4017846,Technology,EDP Services
CTSO,Cytosorbents Corporation Common Stock,$8.315,-0.025,-0.30%,358857764.00,United States,,33853,Health Care,Medical/Dental Instruments
CTXR,Citius Pharmaceuticals Inc. Common Stock,$2.7335,0.1335,5.135%,370318034.00,United States,,4922801,Health Care,Major Pharmaceuticals
CTXRW,Citius Pharmaceuticals Inc. Warrant,$1.5807,0.3502,28.46%,0.00,United States,,53271,Health Care,Major Pharmaceuticals
CTXS,Citrix Systems Inc. Common Stock,$121.1512,0.7412,0.616%,15042986502.00,United States,1995,501122,Technology,Computer Software: Prepackaged Software
CUBA,Herzfeld Caribbean Basin Fund Inc. (The) Common Stock,$6.43,0.05,0.784%,39439466.00,United States,,31033,Finance,Investment Managers
CUE,Cue Biopharma Inc. Common Stock,$13.5499,0.2299,1.726%,413291855.00,United States,2018,50080,Health Care,Major Pharmaceuticals
CUEN,Cuentas Inc. Common Stock,$2.46,-0.1698,-6.457%,34020818.00,United States,,69191,Technology,Computer Software: Prepackaged Software
CUENW,Cuentas Inc. Warrant,$0.70,-0.0101,-1.422%,0.00,United States,,500,Miscellaneous,Business Services
CURI,CuriosityStream Inc. Class A Common Stock,$15.015,-0.105,-0.694%,789282079.00,United States,2020,374433,Consumer Services,Broadcasting
CURIW,CuriosityStream Inc. Warrant,$5.32,-0.06,-1.115%,0.00,United States,2020,4323,Consumer Services,Movies/Entertainment
CUTR,Cutera Inc. Common Stock,$46.5263,0.1663,0.359%,828320467.00,United States,2004,44294,Health Care,Biotechnology: Electromedical & Electrotherapeutic Apparatus
CVAC,CureVac N.V. Ordinary Shares,$98.33,0.51,0.521%,18310994507.00,Germany,2020,585082,Health Care,Major Pharmaceuticals
CVBF,CVB Financial Corporation Common Stock,$21.78,-0.27,-1.224%,2960315210.00,United States,,114007,Finance,Major Banks
CVCO,Cavco Industries Inc. Common Stock When Issued,$215.53,-3.04,-1.391%,1977926569.00,United States,,9910,Basic Industries,Homebuilding
CVCY,Central Valley Community Bancorp Common Stock,$20.61,-0.25,-1.198%,258235241.00,United States,,18088,Finance,Major Banks
CVET,Covetrus Inc. Common Stock,$28.11,0.76,2.779%,3839528146.00,United States,,140584,Health Care,Managed Health Care
CVGI,Commercial Vehicle Group Inc. Common Stock,$11.40,-0.04,-0.35%,375469534.00,United States,2004,140438,Capital Goods,Auto Parts:O.E.M.
CVGW,Calavo Growers Inc. Common Stock,$68.23,-0.17,-0.249%,1206574544.00,United States,,72008,Consumer Non-Durables,Specialty Foods
CVLG,Covenant Logistics Group Inc. Class A Common Stock,$22.80,0.34,1.514%,381945874.00,United States,,25402,Transportation,Trucking Freight/Courier Services
CVLT,Commvault Systems Inc. Common Stock,$81.37,0.71,0.88%,3745155393.00,United States,2006,109595,Technology,Computer Software: Prepackaged Software
CVLY,Codorus Valley Bancorp Inc Common Stock,$19.61,-0.03,-0.153%,193681930.00,United States,,16051,Finance,Savings Institutions
CVV,CVD Equipment Corporation Common Stock,$4.25,-0.02,-0.468%,28408194.00,United States,,25720,Technology,Industrial Machinery/Components
CWBC,Community West Bancshares Common Stock,$12.9438,-0.2541,-1.925%,110364185.00,United States,,617,Finance,Major Banks
CWBR,CohBar Inc. Common Stock,$1.3799,0.0199,1.463%,85261710.00,United States,,157027,Health Care,Biotechnology: In Vitro & In Vivo Diagnostic Substances
CWCO,Consolidated Water Co. Ltd. Ordinary Shares,$12.88,-0.22,-1.679%,195794998.00,Cayman Islands,,79411,Public Utilities,Water Supply
CWST,Casella Waste Systems Inc. Class A Common Stock,$65.33,-0.48,-0.729%,3355566480.00,United States,1997,34094,Public Utilities,Environmental Services
CXDC,China XD Plastics Company Limited Common Stock,$0.64,0.0077,1.218%,45151258.00,China,,130087,Consumer Non-Durables,Plastic Products
CXDO,Crexendo Inc. Common Stock,$5.35,0.01,0.187%,115251813.00,United States,,7366,Consumer Services,Telecommunications Equipment
CYAD,Celyad Oncology SA American Depositary Shares,$5.40,-0.43,-7.376%,81027842.00,Belgium,2015,102473,Health Care,Major Pharmaceuticals
CYAN,Cyanotech Corporation Common Stock,$2.98,-0.02,-0.667%,18169278.00,United States,,29385,Consumer Non-Durables,Farming/Seeds/Milling
CYBE,CyberOptics Corporation Common Stock,$34.965,1.055,3.111%,255222682.00,United States,1987,20456,Capital Goods,Electronic Components
CYBR,CyberArk Software Ltd. Ordinary Shares,$139.83,3.26,2.387%,5559593537.00,Israel,2014,194493,Technology,Computer Software: Prepackaged Software
CYCC,Cyclacel Pharmaceuticals Inc. Common Stock,$7.12,0.10,1.425%,65746863.00,United States,,37233,Health Care,Major Pharmaceuticals
CYCCP,Cyclacel Pharmaceuticals Inc. 6% Convertible Preferred Stock,$9.38,0.00,0.00%,0.00,United States,,4,Health Care,Major Pharmaceuticals
CYCN,Cyclerion Therapeutics Inc. Common Stock,$4.41,0.44,11.083%,178256209.00,United States,,3382464,Health Care,Major Pharmaceuticals
CYRN,CYREN Ltd. Ordinary Shares,$0.745,0.0168,2.307%,56351952.00,United States,,1005285,Technology,Computer Software: Prepackaged Software
CYRX,CryoPort Inc. Common Stock,$62.06,0.90,1.472%,2834991159.00,United States,,69337,,
CYTH,Cyclo Therapeutics Inc. Common Stock,$10.4186,-0.3614,-3.353%,66248345.00,United States,,302242,Health Care,Major Pharmaceuticals
CYTHW,Cyclo Therapeutics Inc. Warrant,$5.295,-0.155,-2.844%,0.00,United States,,6879,Basic Industries,Major Chemicals
CYTK,Cytokinetics Incorporated Common Stock,$21.80,0.76,3.612%,1563891517.00,United States,2004,175104,Health Care,Major Pharmaceuticals
CZNC,Citizens & Northern Corp Common Stock,$24.90,-0.10,-0.40%,398457644.00,United States,,10346,Finance,Major Banks
CZR,Caesars Entertainment Inc. Common Stock,$107.48,-2.83,-2.565%,22430928000.00,United States,,968595,Consumer Services,Hotels/Resorts
CZWI,Citizens Community Bancorp Inc. Common Stock,$13.69,0.00,0.00%,149064291.00,United States,,7246,Finance,Savings Institutions
DADA,Dada Nexus Limited American Depositary Shares,$31.85,0.30,0.951%,7541874185.00,China,2020,535422,Consumer Services,Department/Specialty Retail Stores
DAIO,Data I/O Corporation Common Stock,$6.87,0.215,3.231%,57892549.00,United States,1981,67231,Capital Goods,Industrial Machinery/Components
DAKT,Daktronics Inc. Common Stock,$6.89,0.09,1.324%,309818365.00,United States,1994,63355,Capital Goods,Office Equipment/Supplies/Services
DARE,Dare Bioscience Inc. Common Stock,$1.40,0.01,0.719%,69090108.00,United States,2014,463411,Health Care,Major Pharmaceuticals
DAWN,Day One Biopharmaceuticals Inc. Common Stock,$20.7005,-0.1395,-0.669%,1281960002.00,United States,2021,11745,Health Care,Major Pharmaceuticals
DBDR,Roman DBDR Tech Acquisition Corp. Class A Common Stock,$10.12,0.00,0.00%,292923400.00,United States,2020,3214,,
DBDRU,Roman DBDR Tech Acquisition Corp. Unit,$10.71,-0.09,-0.833%,0.00,United States,2020,3000,,
DBDRW,Roman DBDR Tech Acquisition Corp. Warrant,$1.44,0.02,1.408%,0.00,United States,2020,21302,Finance,Business Services
DBGI,Digital Brands Group Inc. Common Stock,$3.38,-0.06,-1.744%,35465458.00,United States,2021,485704,Consumer Non-Durables,Apparel
DBGIW,Digital Brands Group Inc. Warrant,$0.7798,0.0702,9.893%,0.00,United States,2021,2271,Consumer Non-Durables,Apparel
DBTX,Decibel Therapeutics Inc. Common Stock,$8.825,-0.085,-0.954%,219759541.00,United States,2021,29343,Health Care,Major Pharmaceuticals
DBVT,DBV Technologies S.A. American Depositary Shares,$6.32,0.21,3.437%,693909292.00,France,2014,43426,Health Care,Major Pharmaceuticals
DBX,Dropbox Inc. Class A Common Stock,$29.645,-0.075,-0.252%,11587562480.00,United States,2018,2077287,Technology,Computer Software: Prepackaged Software
DCBO,Docebo Inc. Common Shares,$57.44,1.97,3.551%,1877961109.00,Canada,,39275,,
DCOM,Dime Community Bancshares Inc. Common Stock,$33.99,-0.14,-0.41%,1413434620.00,United States,,63117,Finance,Savings Institutions
DCOMP,Dime Community Bancshares Inc. Fixed-Rate Non-Cumulative Perpetual Preferred Stock Series A,$25.80,0.00,0.00%,0.00,United States,,462,Finance,Savings Institutions
DCPH,Deciphera Pharmaceuticals Inc. Common Stock,$35.92,0.50,1.412%,2082084696.00,United States,2017,85379,Health Care,Major Pharmaceuticals
DCRB,Decarbonization Plus Acquisition Corporation Class A Common Stock,$10.71,-0.12,-1.108%,302189365.00,United States,2020,320299,,
DCRBU,Decarbonization Plus Acquisition Corporation Unit,$11.895,-0.025,-0.21%,0.00,United States,2020,1241,,
DCRBW,Decarbonization Plus Acquisition Corporation Warrant,$2.41,0.11,4.783%,0.00,United States,2020,38318,Finance,Business Services
DCRC,Decarbonization Plus Acquisition Corporation III Class A Common Stock,$12.99,0.55,4.421%,574807500.00,United States,2021,1592620,,
DCRCU,Decarbonization Plus Acquisition Corporation III Unit,$14.24,0.93,6.987%,0.00,United States,2021,366317,Finance,Business Services
DCRCW,Decarbonization Plus Acquisition Corporation III Warrant,$3.74,0.8401,28.97%,0.00,United States,2021,739615,Finance,Business Services
DCRN,Decarbonization Plus Acquisition Corporation II Class A Common stock,$9.85,-0.02,-0.203%,495578125.00,United States,2021,113262,,
DCRNU,Decarbonization Plus Acquisition Corporation II Unit,$10.35,0.00,0.00%,0.00,United States,2021,20934,,
DCRNW,Decarbonization Plus Acquisition Corporation II Warrant,$1.42,0.00,0.00%,0.00,United States,2021,222956,Finance,Business Services
DCT,Duck Creek Technologies Inc. Common Stock,$40.41,0.36,0.899%,5317509146.00,United States,2020,180203,Technology,Retail: Computer Software & Peripheral Equipment
DCTH,Delcath Systems Inc. Common Stock,$11.65,-0.22,-1.853%,75403437.00,United States,,14121,Health Care,Medical Specialities
DDMX,DD3 Acquisition Corp. II Class A Common Stock,$9.86,-0.08,-0.805%,71220752.00,Mexico,2021,266,,
DDMXU,DD3 Acquisition Corp. II Unit,$10.56,0.00,0.00%,0.00,Mexico,2020,50,,
DDMXW,DD3 Acquisition Corp. II Warrant,$1.2408,-0.0592,-4.554%,0.00,Mexico,2021,8338,,
DDOG,Datadog Inc. Class A Common Stock,$97.09,1.61,1.686%,29940949063.00,United States,2019,1372973,Technology,EDP Services
DENN,Denny's Corporation Common Stock,$17.27,-0.18,-1.032%,1107781473.00,United States,,113769,Consumer Services,Restaurants
DFFN,Diffusion Pharmaceuticals Inc. Common Stock,$0.7669,-0.0226,-2.863%,78150161.00,United States,,921071,Health Care,Major Pharmaceuticals
DFH,Dream Finders Homes Inc. Class A Common Stock,$23.42,-0.14,-0.594%,2166853108.00,United States,2021,169780,,
DFPH,DFP Healthcare Acquisitions Corp. Class A Common Stock,$10.10,-0.05,-0.493%,290375000.00,United States,2020,13365,Finance,Major Banks
DFPHU,DFP Healthcare Acquisitions Corp. Unit,$10.12,0.00,0.00%,0.00,United States,2020,36,Finance,Major Banks
DGICA,Donegal Group Inc. Class A Common Stock,$15.325,0.235,1.557%,472989114.00,United States,,54827,Finance,Property-Casualty Insurers
DGICB,Donegal Group Inc. Class B Common Stock,$14.60,0.00,0.00%,450612794.00,United States,1986,10,Finance,Property-Casualty Insurers
DGII,Digi International Inc. Common Stock,$19.92,0.26,1.322%,677867959.00,United States,1989,76117,Technology,Computer peripheral equipment
DGLY,Digital Ally Inc. Common Stock,$1.952,0.002,0.103%,100554725.00,United States,,807673,Miscellaneous,Diversified Manufacture
DGNS,Dragoneer Growth Opportunities Corp. II Class A Ordinary Shares,$10.29,0.05,0.488%,362743080.00,United States,2020,3110,Finance,Business Services
DGNU,Dragoneer Growth Opportunities Corp. III Class A Ordinary Shares,$10.052,0.002,0.02%,502600000.00,United States,2021,10280,Finance,Business Services
DHBC,DHB Capital Corp. Class A common stock,$9.71,0.00,0.00%,348953125.00,United States,2021,262,,
DHBCU,DHB Capital Corp. Unit,$10.00,0.00,0.00%,359375000.00,United States,2021,215,,
DHBCW,DHB Capital Corp. Warrant,$0.74,0.01,1.37%,0.00,United States,2021,6796,,
DHC,Diversified Healthcare Trust Common Shares of Beneficial Interest,$4.1619,0.1119,2.763%,991649579.00,United States,,408782,Consumer Services,Real Estate Investment Trusts
DHCA,DHC Acquisition Corp. Class A ordinary share,$9.70,0.00,0.00%,374662500.00,United States,2021,111,Finance,Business Services
DHCAU,DHC Acquisition Corp. Unit,$10.00,-0.04,-0.398%,0.00,United States,2021,93705,Finance,Business Services
DHCAW,DHC Acquisition Corp. Warrant,$0.9001,0.0795,9.688%,0.00,United States,2021,267,Finance,Business Services
DHCNI,Diversified Healthcare Trust 5.625% Senior Notes due 2042,$23.30,-0.05,-0.214%,0.00,United States,,7492,Consumer Services,Real Estate Investment Trusts
DHCNL,Diversified Healthcare Trust 6.25% Senior Notes Due 2046,$24.932,-0.058,-0.232%,0.00,United States,,10850,Consumer Services,Real Estate Investment Trusts
DHHC,DiamondHead Holdings Corp. Class A Common Stock,$9.73,0.00,0.00%,419606250.00,United States,2021,15,,
DHHCU,DiamondHead Holdings Corp. Unit,$9.99,0.00,0.00%,0.00,United States,2021,1050,,
DHHCW,DiamondHead Holdings Corp. Warrant,$1.205,0.145,13.679%,0.00,United States,2021,1640,Finance,Business Services
DHIL,Diamond Hill Investment Group Inc. Class A Common Stock,$176.50,-0.85,-0.479%,563728645.00,United States,,1808,Finance,Investment Managers
DIBS,1stdibs.com Inc. Common Stock,$24.90,0.79,3.277%,911241023.00,United States,2021,161008,,
DIOD,Diodes Incorporated Common Stock,$77.89,0.84,1.09%,3475195931.00,United States,,46569,Technology,Semiconductors
DISA,Disruptive Acquisition Corporation I Class A Ordinary Shares,$9.66,0.00,0.00%,332062500.00,United States,2021,58,Finance,Business Services
DISAU,Disruptive Acquisition Corporation I Unit,$9.94,0.00,0.00%,0.00,United States,2021,210,Finance,Business Services
DISAW,Disruptive Acquisition Corporation I Warrant,$0.9191,0.1191,14.888%,0.00,United States,2021,43426,Finance,Business Services
DISCA,Discovery Inc. Series A Common Stock,$31.0385,0.2485,0.807%,15687087802.00,United States,,3172238,Consumer Services,Television Services
DISCB,Discovery Inc. Series B Common Stock,$68.5283,-1.7217,-2.451%,34634710409.00,United States,,1627,Consumer Services,Television Services
DISCK,Discovery Inc. Series C Common Stock,$29.13,0.19,0.657%,14722517766.00,United States,,1433069,Consumer Services,Television Services
DISH,DISH Network Corporation Class A Common Stock,$39.91,-0.16,-0.399%,21060688870.00,United States,1995,1045114,Consumer Services,Television Services
DJCO,Daily Journal Corp. (S.C.) Common Stock,$345.505,7.535,2.229%,477054647.00,United States,,2513,Consumer Services,Newspapers/Magazines
DKDCU,Data Knights Acquisition Corp. Unit,$10.20,0.05,0.493%,0.00,United Kingdom,2021,19923,,
DKNG,DraftKings Inc. Class A Common Stock,$51.5438,-1.5962,-3.004%,20702254193.00,United States,2019,8943642,Consumer Services,Services-Misc. Amusement & Recreation
DLCA,Deep Lake Capital Acquisition Corp. Class A Ordinary Shares,$9.68,0.00,0.00%,250470000.00,United States,2021,20405,Finance,Business Services
DLCAU,Deep Lake Capital Acquisition Corp. Unit,$10.03,-0.02,-0.199%,0.00,United States,2021,2500,Finance,Business Services
DLCAW,Deep Lake Capital Acquisition Corp. Warrant,$0.7419,0.0019,0.257%,0.00,United States,2021,8962,Finance,Business Services
DLHC,DLH Holdings Corp.,$12.67,0.43,3.513%,158943959.00,United States,,11511,Miscellaneous,Business Services
DLO,DLocal Limited Class A Common Shares,$30.76,-0.24,-0.774%,9010088931.00,Uruguay,2021,122837,,
DLPN,Dolphin Entertainment Inc. Common Stock,$9.55,-0.14,-1.445%,72582922.00,United States,,1562977,,
DLTH,Duluth Holdings Inc. Class B Common Stock,$17.93,0.46,2.633%,592100920.00,United States,2015,42869,Consumer Services,Department/Specialty Retail Stores
DLTR,Dollar Tree Inc. Common Stock,$99.62,-1.56,-1.542%,23107244729.00,United States,1995,979033,Consumer Services,Department/Specialty Retail Stores
DMAC,DiaMedica Therapeutics Inc. Common Stock,$9.39,0.43,4.799%,175959905.00,United States,2018,114834,Health Care,Major Pharmaceuticals
DMLP,Dorchester Minerals L.P. Common Units Representing Limited Partnership Interests,$16.6795,0.8495,5.366%,578441290.00,United States,,85382,Energy,Oil & Gas Production
DMRC,Digimarc Corporation Common Stock,$33.3399,-0.7001,-2.057%,563938774.00,United States,,38291,Technology,EDP Services
DMTK,DermTech Inc. Common Stock,$43.70,3.15,7.768%,1264620666.00,United States,2017,400079,Health Care,Managed Health Care
DNLI,Denali Therapeutics Inc. Common Stock,$74.915,-0.085,-0.113%,9079114412.00,United States,2017,160922,Health Care,Biotechnology: Biological Products (No Diagnostic Substances)
DOCU,DocuSign Inc. Common Stock,$259.77,6.76,2.672%,50612320421.00,United States,2018,2698350,Technology,EDP Services
DOGZ,Dogness (International) Corporation Class A Common Stock,$1.94,-0.11,-5.366%,56987139.00,China,2017,358639,Consumer Durables,Miscellaneous manufacturing industries
DOMO,Domo Inc. Class B Common Stock,$73.365,2.165,3.041%,2324246779.00,United States,2018,154028,Technology,Computer Software: Prepackaged Software
DOOO,BRP Inc. (Recreational Products) Common Subordinate Voting Shares,$77.47,1.10,1.44%,6506719709.00,Canada,,47622,Consumer Non-Durables,Recreational Products/Toys
DORM,Dorman Products Inc. Common Stock,$101.46,-1.47,-1.428%,3255098465.00,United States,,17777,Capital Goods,Auto Parts:O.E.M.
DOX,Amdocs Limited Ordinary Shares,$80.50,-0.34,-0.421%,10276147000.00,Guernsey,,160508,Technology,EDP Services
DOYU,DouYu International Holdings Limited ADS,$8.32,0.30,3.741%,2699089453.00,China,2019,1307815,Technology,Computer Software: Programming Data Processing
DRIO,DarioHealth Corp. Common Stock,$20.00,0.26,1.317%,310864320.00,Israel,,144833,Health Care,Medical/Dental Instruments
DRNA,Dicerna Pharmaceuticals Inc. Common Stock,$37.735,0.375,1.004%,2901825575.00,United States,2014,422589,Health Care,Biotechnology: Commercial Physical & Biological Resarch
DRRX,DURECT Corporation Common Stock,$1.7129,-0.0371,-2.12%,389524049.00,United States,2000,339280,Health Care,Major Pharmaceuticals
DRTT,DIRTT Environmental Solutions Ltd. Common Shares,$3.53,-0.03,-0.843%,298973043.00,Canada,,24503,,
DRVN,Driven Brands Holdings Inc. Common Stock,$30.16,0.33,1.106%,5049141094.00,United States,2021,124911,,
DSAC,Duddell Street Acquisition Corp. Class A Ordinary Shares,$9.70,-0.03,-0.308%,212187500.00,Hong Kong,2020,2261,Finance,Business Services
DSACU,Duddell Street Acquisition Corp. Unit,$10.23,0.00,0.00%,0.00,Hong Kong,2020,12,Finance,Business Services
DSACW,Duddell Street Acquisition Corp. Warrant,$1.00,-0.0175,-1.72%,0.00,Hong Kong,2020,2637,Finance,Business Services
DSEY,Diversey Holdings Ltd. Ordinary Shares,$18.20,0.83,4.778%,5482661293.00,United States,2021,336553,Consumer Durables,Specialty Chemicals
DSGN,Design Therapeutics Inc. Common Stock,$27.56,0.47,1.735%,1532813394.00,United States,2021,188158,Health Care,Major Pharmaceuticals
DSGX,Descartes Systems Group Inc. (The) Common Stock,$67.11,1.25,1.898%,5671765075.00,Canada,,38004,,
DSKE,Daseke Inc. Common Stock,$7.53,0.04,0.534%,490908328.00,United States,2015,108186,,
DSKEW,Daseke Inc. Warrant,$0.1299,-0.0097,-6.948%,0.00,United States,2015,266408,,
DSP,Viant Technology Inc. Class A Common Stock,$30.935,1.725,5.906%,1823171518.00,United States,2021,130993,Technology,EDP Services
DSPG,DSP Group Inc. Common Stock,$16.25,0.04,0.247%,393685208.00,United States,1994,36656,Technology,Semiconductors
DSWL,Deswell Industries Inc. Common Shares,$4.7195,0.1195,2.598%,75111970.00,Macau,1995,47161,Consumer Non-Durables,Plastic Products
DTEA,DAVIDsTEA Inc. Common Stock,$5.3114,0.1714,3.335%,139454891.00,Canada,2015,275849,,
DTIL,Precision BioSciences Inc. Common Stock,$11.531,-0.009,-0.078%,662805639.00,United States,2019,192947,Health Care,Major Pharmaceuticals
DTOC,Digital Transformation Opportunities Corp. Class A Common Stock,$9.78,0.00,0.00%,407703750.00,United States,2021,40,,
DTOCU,Digital Transformation Opportunities Corp. Units,$9.91,-0.01,-0.101%,0.00,United States,2021,24334,,
DTOCW,Digital Transformation Opportunities Corp. Warrant,$0.7998,0.0198,2.538%,0.00,United States,2021,45734,Finance,Business Services
DTSS,Datasea Inc. Common Stock,$2.66,0.04,1.527%,57121207.00,China,,15991,Technology,Retail: Computer Software & Peripheral Equipment
DTST,Data Storage Corporation Common Stock,$5.90,-0.25,-4.065%,28667327.00,United States,,105578,Technology,EDP Services
DTSTW,Data Storage Corporation Warrant,$1.1825,-0.0175,-1.458%,0.00,United States,,7636,,
DUNE,Dune Acquisition Corporation Class A Common Stock,$9.79,0.00,0.00%,,United States,2021,14588,,
DUNEU,Dune Acquisition Corporation Unit,$10.12,0.03,0.297%,0.00,United States,2020,8373,,
DUNEW,Dune Acquisition Corporation Warrant,$0.75,0.01,1.351%,0.00,United States,2021,31667,Finance,Business Services
DUO,Fangdd Network Group Ltd. American Depositary Shares,$3.36,-0.05,-1.466%,268285124.00,China,2019,81757,Technology,Computer Software: Programming Data Processing
DUOT,Duos Technologies Group Inc. Common Stock,$10.27,0.2949,2.956%,36677189.00,United States,,44201,Technology,Computer Software: Prepackaged Software
DVAX,Dynavax Technologies Corporation Common Stock,$9.245,0.065,0.708%,1059368020.00,United States,2004,955128,Health Care,Major Pharmaceuticals
DWSN,Dawson Geophysical Company Common Stock,$2.75,0.02,0.733%,64564698.00,United States,,13296,Energy,Oil & Gas Production
DXCM,DexCom Inc. Common Stock,$406.66,6.47,1.617%,39326410314.00,United States,2005,398049,Health Care,Medical/Dental Instruments
DXPE,DXP Enterprises Inc. Common Stock,$32.27,-0.22,-0.677%,619807405.00,United States,,48847,Capital Goods,Industrial Machinery/Components
DXYN,Dixie Group Inc. (The) Common Stock,$2.6438,0.0438,1.685%,41667853.00,United States,,24294,Consumer Durables,Home Furnishings
DYAI,Dyadic International Inc. Common Stock,$3.615,-0.065,-1.766%,99608278.00,United States,,53281,Health Care,Biotechnology: Biological Products (No Diagnostic Substances)
DYN,Dyne Therapeutics Inc. Common Stock,$21.19,0.67,3.265%,1090159875.00,United States,2020,363883,Consumer Durables,Specialty Chemicals
DYNS,Dynamics Special Purpose Corp. Class A Common Stock,$10.00,0.01,0.10%,294655000.00,United States,2021,19270,Technology,Computer Manufacturing
DYNT,Dynatronics Corporation Common Stock,$1.25,0.03,2.459%,21705818.00,United States,,27147,Health Care,Medical/Dental Instruments
DZSI,DZS Inc. Common Stock,$21.90,1.14,5.491%,589497323.00,United States,,282209,Public Utilities,Telecommunications Equipment
EA,Electronic Arts Inc. Common Stock,$148.07,1.68,1.148%,42376327430.00,United States,,860184,Technology,Computer Software: Prepackaged Software
EAC,Edify Acquisition Corp. Class A Common Stock,$9.70,0.00,0.00%,334650000.00,United States,2021,8403,,
EACPU,Edify Acquisition Corp. Units,$9.94,0.03,0.303%,0.00,United States,2021,9550,,
